uid,title,day,start_date,start_time,end_time,category,description,organiser,organiser_emails,organiser_affiliation,organiser_bio,image,web_link,slack_channel,channel_url,Zoom link
1,Registration,1,2024-11-10,8:00,9:00,Registration,Register!,,,,,,,,,
2,Online Q&A w/ volunteers,1,2024-11-10,8:00,9:00,Meetup,Having issues with Zoom or Slack? Need help navigating the conference program or materials? Virtual volunteers will be available to meet with you and answer any questions you may have!,,,,,,,help-desk,https://ismir2024.slack.com/archives/C07TPGHFWR0,
3,Morning Tutorial T1,1,2024-11-10,9:00,12:30,Tutorials,"Language serves as an efficient interface for communication between humans as well as between humans and machines. Through the integration of recent advancements in deep learning-based language models, the understanding, search, and creation of music is becoming capable of catering to user preferences with better diversity and control. This tutorial will start with an introduction to how machines understand natural language, alongside recent advancements in language models, and their application across various domains. We will then shift our focus to MIR tasks that incorporate these cutting-edge language models. The core of our discussion will be segmented into three pivotal themes: music understanding through audio annotation and beyond, text-to-music retrieval for music search, and text-to-music generation to craft novel sounds. In parallel, we aim to establish a solid foundation for the emergent field of music-language research, and encourage participation from new researchers by offering comprehensive access to 1) relevant datasets, 2) evaluation methods, and 3) coding best practices.","Seung Heon Doh, Ilaria Manco, Zachary Novack, Jong Wook Kim and Ke Chen",,,,,,t1-connecting-music-audio,https://ismir2024.slack.com/archives/C07USUU43NF,https://us02web.zoom.us/j/87844902244?pwd=K6qQ3aCfsUKaNalKwZZKJ07wnRpNOa.1
4,Morning Tutorial T2,1,2024-11-10,9:00,12:30,Tutorials,"This tutorial reflects on the journey of Music Information Retrieval (MIR) over the last 25 years, offering insights from three distinct perspectives: research, community, and education. Drawing from the presenters' personal experiences and reflections, it provides a holistic view of MIR's evolution, covering historical milestones, community dynamics, and pedagogical insights. Through this approach, the tutorial aims to give attendees a nuanced understanding of MIR’s past, present, and future directions, fostering a deeper appreciation for the field and its interdisciplinary and educational aspects.
 

 The tutorial is structured into three parts, each based on one of the aforementioned perspectives. The first part delves into the research journey of MIR. It covers the inception of query-by-humming and the emergence of MP3s, discusses the establishment of standard tasks such as beat tracking and genre classification, and highlights significant advancements, applications, and future challenges in the field. The second part explores the community aspect of ISMIR. It traces the growth of the society from a small symposium to a well-recognized international community, emphasizing core values such as interdisciplinary collaboration and diversity, and invites the audience to imagine the future of the ISMIR community together. Lastly, the third part discusses the role of music as an educational domain. It examines the broad implications of MIR research, the value of pursuing a PhD in MIR, and the significant educational resources available.
 

 Each part invites audience interaction, aiming to provide attendees with a deeper appreciation of MIR's past achievements and insights into its potential future directions. This tutorial is not just a historical overview but also a platform for fostering a deeper understanding of the interplay between technology and music.","Masataka Goto, Jin Ha Lee, and Meinard Müller",,,,,,t2-exploring-25-years,https://ismir2024.slack.com/archives/C07UW844R7U,https://us02web.zoom.us/j/82635337236?pwd=hZdTOdR5SaXa3tES9kbfYkZPnUM4sn.1
5,Morning Tutorial T3,1,2024-11-10,9:00,12:30,Tutorials,"This tutorial will cover the theory and practice of diffusion models for music and sound. We will explain the methodology, explore its history, and demonstrate music and sound-specific applications such as real-time generation and various other downstream tasks. By bridging the gap from computer vision techniques and models, we aim to spark further research interest and democratize access to diffusion models for the music and sound domains. 
 

 The tutorial comprises four sections. The first provides an overview of deep generative models and delves into the fundamentals of diffusion models. The second section explores applications such as sound and music generation, as well as utilizing pre-trained models for music/sound editing and restoration. In the third section, a hands-on demonstration will focus on training diffusion models and applying pre-trained models for music/sound restoration. The final section outlines future research directions.
 

 We anticipate that this tutorial, emphasizing both the foundational principles and practical implementation of diffusion models, will stimulate interest among the music and sound signal processing community. It aims to illuminate insights and applications concerning diffusion models, drawn from methodologies in computer vision.","Chieh-Hsin Lai, Koichi Saito, Bac Nguyen Cong, Yuki Mitsufuji, and Stefano Ermon",,,,,,t3-from-white-noise,https://ismir2024.slack.com/archives/C07UPKD2SS2,https://us02web.zoom.us/j/82145705825?pwd=BgRaFJb9Zabtlqr8ylgUPNIikQkLcl.1
7,Online Q&A w/ volunteers,1,2024-11-10,13:00,14:00,Meetup,,,,,,,,help-desk,https://ismir2024.slack.com/archives/C07TPGHFWR0,https://us02web.zoom.us/j/81805661292?pwd=ZZKs8fVNlmJb9zuDHVFQEDshAOcDeG.1
8,Afternoon Tutorial T4,1,2024-11-10,14:00,17:30,Tutorials,"In one form or another, most MIR research depends on the judgment of humans. Humans provide our ground-truth data, whether through explicit annotation or through observable behavior (e.g., listening histories); Humans also evaluate our results, whether in academic research reports or in the commercial marketplace. Will users like it? Will customers buy it? Does it sound good? These are all critical questions for MIR researchers which can only be answered by asking people. Unfortunately, measuring and interpreting the judgments and experiences of humans in a rigorous manner is difficult. Human responses can be fickle, changeable, and inconsistent—they are, by definition, subjective. There are many factors that influence human responses, some of which can be controlled or accounted for in experimental design, and others which must be tolerated but ameliorated through statistical analysis. Fortunately, researchers in the field of behavioral psychology have amassed extensive expertise and institutional knowledge related to the practice and pedagogy of human-subject research, but MIR researchers receive little exposure to research methods involving human subjects. This tutorial, led by MIR researchers with training (and publications) in psychological research, aims to share these insights with the ISMIR community. The tutorial will introduce key concepts, terminology, and concerns in carrying out human-subject research, all in the context of MIR. Through the discussion of real and hypothetical human research, we will explore the nuances of experiment and survey design, stimuli creation, sampling, psychometric modeling, and statistical analysis. We will review common pitfalls and confounds in human research, and present guidelines for best practices in the field. We will also cover fundamental ethical and legal requirements of human research. Any and all ISMIR members are welcome and encouraged to attend: it is never too early, or too late, in one’s research career to learn (or practice) these essential skills.","Claire Arthur, Nat Condit-Schultz, David R. W. Sears, John Ashley Burgoyne, and Josuha Albrecht",,,,,,t4-humans-at-the,https://ismir2024.slack.com/archives/C07V8U99MMX,https://us02web.zoom.us/j/83619614732?pwd=zG13FTM11QpdnTmGM6D6rA4IIfChs0.1
9,Afternoon Tutorial T5,1,2024-11-10,14:00,17:30,Tutorials,"Audio-based MIR (MIR based on the processing of audio signals) covers a broad range of tasks, including analysis (pitch, chord, beats, tagging), similarity/cover identification, and processing/generation of samples or music fragments. A wide range of techniques can be employed for solving each of these tasks, spanning from conventional signal processing and machine learning algorithms to the whole zoo of deep learning techniques.
 

 This tutorial aims to review the various elements of this deep learning zoo commonly applied in Audio-based MIR tasks. We review typical audio front-ends (such as waveform, Log-Mel-Spectrogram, HCQT, SincNet, LEAF, quantization using VQ-VAE, RVQ), as well as projections (including 1D-Conv, 2D-Conv, Dilated-Conv, TCN, WaveNet, RNN, Transformer, Conformer, U-Net, VAE), and examine the various training paradigms (such as supervised, self-supervised, metric-learning, adversarial, encoder-decoder, diffusion). Rather than providing an exhaustive list of all of these elements, we illustrate their use within a subset of (commonly studied) Audio-based MIR tasks such as multi-pitch/chord-estimation, cover-detection, auto-tagging, source separation, music-translation or music generation. This subset of Audio-based MIR tasks is designed to encompass a wide range of deep learning elements. For each tack we address a) the goal of the tasks, b) how it is evaluated, c) provide some popular datasets to train a system, and d) explain (using slides and pytorch code) how we can solve it using deep learning.
 

 The objective is to provide a 101 lecture (introductory lecture) on deep learning techniques for Audio-based MIR. It does not aim at being exhaustive in terms of Audio-based MIR tasks nor on deep learning techniques but to provide an overview for newcomers to Audio-Based MIR on how to solve the most common tasks using deep learning. It will provide a portfolio of codes (Colab notebooks and Jupyter book) to help newcomers achieve the various Audio-based MIR Tasks.","Geoffroy Peeters, Gabriel Meseguer Brocal, Alain Riou, and Stefan Lattner",,,,,,t5-deep-learning-101,https://ismir2024.slack.com/archives/C07UFMQUV7H,https://us02web.zoom.us/j/87836725996?pwd=s1D2bvzrbPplz8ZrYVQSkY1Gqg7ENn.1
10,Afternoon Tutorial T6,1,2024-11-10,14:00,17:30,Tutorials,"Singing, a universal human practice, intertwines with lyrics to form a core part of profound musical experiences, conveying emotions, narratives, and real-world connections. This tutorial explores the commonly used techniques and practices in lyrics and singing voice processing, which are vital in numerous music information retrieval tasks and applications.

Despite the importance of song lyrics in MIR and the industry, high-quality paired audio & transcript annotations are often scarce. In the first part of this tutorial, we'll delve into automatic lyrics transcription and alignment techniques, which significantly reduce the annotation cost and enable more performant solutions. Our tutorial provides insights into the current state-of-the-art methods for transcription and alignment, highlighting their capabilities and limitations while fostering further research into these systems.

Moreover, we present ""lyrics information processing"", which encompasses lyrics generation and leveraging lyrics to discern musically relevant aspects such as emotions, themes, and song structure. Understanding the rich information embedded in lyrics opens avenues for enhancing audio-based tasks by incorporating lyrics as supplementary input. 

Finally, we discuss singing voice conversion as one such task, which involves the conversion of acoustic features embedded in a vocal signal, often relating to timbre and pitch. We explore how lyric-based features can facilitate a model's inherent disentanglement between acoustic and linguistic content, which leads to more convincing conversions. This section closes with a brief discussion on the ethical concerns and responsibilities that should be considered in this area.

This tutorial caters especially to new researchers with an interest in lyrics and singing voice modeling, or those involved in improving lyrics alignment and transcription methodologies. It can also inspire researchers to leverage lyrics for improved performance on tasks like singing voice separation, music and singing voice generation, and cover song and emotion recognition.
","Daniel Stoller, Emir Demirel, Kento Watanabe, and Brendan O’Connor",,,,,,t6-lyrics-and-singing,https://ismir2024.slack.com/archives/C07UW5HJH7D,https://us02web.zoom.us/j/84459641676?pwd=ZAwXfgHHP9bh9eWa1uEcGYyZ2sOaG2.1
11,Welcome Reception,1,2024-11-10,19:00,21:00,Social,"Join us for a warm and lively welcome reception to reconnect with old friends and meet new colleagues! Enjoy drinks, appetizers, and an incredible live band (Camilo y los Cruzers) as we celebrate our community and look forward to an exciting conference ahead. Don’t miss this fantastic opportunity to connect and unwind!",,,,,,,,,
12,Online Q&A w/ volunteers,1,2024-11-10,20:00,21:00,Meetup,Having issues with Zoom or Slack? Need help navigating the conference program or materials? Virtual volunteers will be available to meet with you and answer any questions you may have!,,,,,,,help-desk,https://ismir2024.slack.com/archives/C07TPGHFWR0,https://us02web.zoom.us/j/81805661292?pwd=ZZKs8fVNlmJb9zuDHVFQEDshAOcDeG.1
13,All Tutorials,1,2024-11-10,21:00,6:00,Tutorials,Replay of all tutorials.,,,,,,,,,
14,Online Q&A w/ volunteers,2,2024-11-11,1:00,2:00,Meetup,Having issues with Zoom or Slack? Need help navigating the conference program or materials? Virtual volunteers will be available to meet with you and answer any questions you may have!,,,,,,,help-desk,https://ismir2024.slack.com/archives/C07TPGHFWR0,https://us02web.zoom.us/j/81805661292?pwd=ZZKs8fVNlmJb9zuDHVFQEDshAOcDeG.1
15,Online social event,2,2024-11-11,6:00,7:30,Social,,,,,,,,session-chatter,https://ismir2024.slack.com/archives/C07V56WJC07,https://us02web.zoom.us/j/81805661292?pwd=ZZKs8fVNlmJb9zuDHVFQEDshAOcDeG.1
16,Registration,2,2024-11-11,8:00,8:30,Registration,,,,,,,,,,
17,Online Q&A w/ volunteers,2,2024-11-11,8:00,8:30,Meetup,Having issues with Zoom or Slack? Need help navigating the conference program or materials? Virtual volunteers will be available to meet with you and answer any questions you may have!,,,,,,,help-desk,https://ismir2024.slack.com/archives/C07TPGHFWR0,https://us02web.zoom.us/j/81805661292?pwd=ZZKs8fVNlmJb9zuDHVFQEDshAOcDeG.1
18,Opening Remarks,2,2024-11-11,8:30,9:00,Special Session,Join the General Chairs of ISMIR 2024 to kick off this year’s conference!,"Gautham Mysore, Oriol Nieto, Blair Kaneshiro",,,,,,session-chatter,https://ismir2024.slack.com/archives/C07V56WJC07,https://us02web.zoom.us/j/81805661292?pwd=ZZKs8fVNlmJb9zuDHVFQEDshAOcDeG.1
20,Poster Session - 1,2,2024-11-11,10:15,11:45,Poster session,"**In-person presentations:**

* [Formal Modeling of Structural Repetition using Tree Compression - Zeng Ren (École Polytechnique Fédérale de Lausanne)*, Yannis Rammos (EPFL), Martin A Rohrmeier (Ecole Polytechnique Fédérale de Lausanne)](/poster_207.html)
* [Saraga Audiovisual: a large multimodal open data collection for the analysis of Carnatic Music - Adithi Shankar (Music Technology Group- Universitat Pompeu Fabra)*, Genís Plaja-Roglans (Music Technology Group), Thomas Nuttall (Universitat Pompeu Fabra, Barcelona), Martín Rocamora (Universitat Pompeu Fabra), Xavier Serra (Universitat Pompeu Fabra )](/poster_352.html)
* [X-Cover: Better music version identification system by integrating pretrained ASR model - Xingjian Du (University of Rochester)*, Zou Pei (ByteDance), Mingyu Liu (ByteDance), Xia Liang (Bytedance), Huidong Liang (University of Oxford), Minghang Chu (Bytedance), Zijie Wang (ByteDance), Bilei Zhu (ByteDance AI Lab)](/poster_328.html)
* [FruitsMusic: A Real-World Corpus of Japanese Idol-Group Songs - Hitoshi Suda (National Institute of Advanced Industrial Science and Technology (AIST))*, Shunsuke Yoshida (The University of Tokyo), Tomohiko Nakamura (National Institute of Advanced Industrial Science and Technology (AIST)), Satoru Fukayama (National Institute of Advanced Industrial Science and Technology (AIST)), Jun Ogata (AIST)](/poster_38.html)
* [Classical Guitar Duet Separation using GuitarDuets - a Dataset of Real and Synthesized Guitar Recordings - Marios Glytsos (National Technical University of Athens)*, Christos Garoufis (Athena Research Center), Athanasia Zlatintsi (Athena Research Center), Petros Maragos (National Technical University of Athens)](/poster_262.html)
* [Can LLMs ""Reason"" in Music? An Evaluation of LLMs' Capability of Music Understanding and Generation - Ziya Zhou (HKUST)*, Yuhang Wu (Multimodal Art Projection), Zhiyue Wu (Shenzhen University), Xinyue Zhang (Multimodal Art Projection), Ruibin Yuan (CMU), Yinghao MA (Queen Mary University of London), Lu Wang (Shenzhen University), Emmanouil Benetos (Queen Mary University of London), Wei Xue (The Hong Kong University of Science and Technology), Yike Guo (Hong Kong University of Science and Technology)](/poster_31.html)
* [Music2Latent: Consistency Autoencoders for Latent Audio Compression - Marco Pasini (Queen Mary University of London)*, Stefan Lattner (Sony Computer Science Laboratories, Paris), George Fazekas (QMUL)](/poster_172.html)
* [Robust and Accurate Audio Synchronization Using Raw Features From Transcription Models - Johannes Zeitler (International Audio Laboratories Erlangen)*, Ben Maman (Tel Aviv University), Meinard Müller (International Audio Laboratories Erlangen)](/poster_8.html)
* [Selective Annotation of Few Data for Beat Tracking of Latin American Music Using Rhythmic Features - Lucas S. Maia, Martín Rocamora, Luiz W. P. Biscainho, Magdalena Fuentes*](/poster_510.html)
* [Harnessing the Power of Distributions: Probabilistic Representation Learning on Hypersphere for Multimodal Music Information Retrieval - Takayuki Nakatsuka (National Institute of Advanced Industrial Science and Technology (AIST))*, Masahiro Hamasaki (National Institute of Advanced Industrial Science and Technology (AIST)), Masataka Goto (National Institute of Advanced Industrial Science and Technology (AIST))](/poster_155.html)
* [Towards Automated Personal Value Estimation in Song Lyrics - Andrew M. Demetriou (Delft University of Technology)*, Jaehun Kim (Pandora / SiriusXM), Cynthia Liem (Delft University of Technology)](/poster_335.html)
* [Audio Conditioning for Music Generation via Discrete Bottleneck Features - Simon Rouard (Meta AI Research)*, Alexandre Defossez (Kyutai), Yossi Adi (Facebook AI Research ), Jade Copet (Meta AI Research), Axel Roebel (IRCAM)](/poster_41.html)
* [Variation Transformer: New datasets, models, and comparative evaluation for symbolic music variation generation - Chenyu Gao (University of York)*, Federico Reuben (University of York), Tom Collins (University of York, MAIA, Inc.)](/poster_72.html)
* [Automatic Detection of Moral Values in Music Lyrics - Vjosa Preniqi (Queen Mary University of London)*, Iacopo Ghinassi (Queen Mary University of London), Julia Ive (Queen Mary University of London), Kyriaki Kalimeri (ISI Foundation), Charalampos Saitis (Queen Mary University of London)](/poster_326.html)
* [Semi-Supervised Piano Transcription Using Pseudo-Labeling Techniques - Sebastian Strahl (International Audio Laboratories Erlangen)*, Meinard Müller (International Audio Laboratories Erlangen)](/poster_214.html)
* [Note-Level Transcription of Choral Music - Huiran Yu (University of Rochester)*, Zhiyao Duan (University of Rochester)](/poster_364.html)
* [Learning Multifaceted Self-Similarity over Time and Frequency for Music Structure Analysis - Tsung-Ping Chen (Kyoto University)*, Kazuyoshi Yoshii (Kyoto University)](/poster_12.html)
* [A Contrastive Self-Supervised Learning scheme for beat tracking amenable to few-shot learning - Antonin Gagneré (LTCI - Télécom Paris, IP Paris)*, Slim Essid (  LTCI - Télécom Paris, IP Paris), Geoffroy Peeters (LTCI - Télécom Paris, IP Paris)](/poster_283.html)
* [Using Pairwise Link Prediction and Graph Attention Networks for Music Structure Analysis - Morgan Buisson (Telecom-Paris)*, Brian McFee (New York University), Slim Essid (Telecom Paris - Institut Polytechnique de Paris)](/poster_405.html)

**Remote presentations:**

* [Harmonic and Transposition Constraints Arising from the Use of the Roland TR-808 Bass Drum - Emmanuel Deruty (Sony Computer Science Laboratories)*](/poster_86.html)",Claire Arthur,,,,,,session-chatter,https://ismir2024.slack.com/archives/C07V56WJC07,
,,,,,,,,,,,,,,,,
22,Mindfulness session,2,2024-11-11,11:45,12:45,Meetup,"soundBrilliance is an innovative digital health company using enhanced music, psychology, and measurement techniques to create tools and exercises which empower people to better self-manage fundamental health – emotional balance, fitness, quality sleep and pain control. The experiences presented in the ISMIR 2024 Mindfulness sessions are designed to help guide you into a deeper sense of Calm. All visuals are naturally produced and captured, with no AI intervention.<br/><br/> ![SoundBrilliance](/static/images/soundbrilliance.svg ""SoundBrilliance"")",soundBrilliance,,,,,,,,https://us02web.zoom.us/j/81805661292?pwd=ZZKs8fVNlmJb9zuDHVFQEDshAOcDeG.1
23,Towards a fairer approach to generative AI training,2,2024-11-11,13:00,14:00,All Meeting,"Ed will discuss the issues that arise when generative AI companies scrape training data without consent, and the alternative - licensing training data - that is being embraced by many AI music companies.",Ed Newton-Rex,,,"Ed Newton-Rex is the founder of Fairly Trained, a non-profit that certifies generative AI companies for fair training data practices. He is also a Visiting Scholar at Stanford University.

In 2010, Ed founded Jukedeck, one of the first AI music generation startups. Jukedeck let video creators generate music for their videos, and was used to create more than a million pieces of music. It was acquired by ByteDance in 2019\. At ByteDance, Ed led the AI Music lab, then led Product for TikTok in Europe.

In 2022 Ed joined Stability AI, the company behind Stable Diffusion, to lead their Audio team. His team launched Stable Audio, Stability’s music generation product, which was named one of TIME Magazine’s best inventions of the year in 2023\. He resigned from Stability in November 2023 due to the company’s policy of training AI models on copyrighted work without consent, and in 2024 founded Fairly Trained. He is a published composer of choral music.",https://confcats-siteplex.s3.us-east-1.amazonaws.com/ismir24/large_ed_newton_rex_fairly_trained_ai_music_companies_copy_5c8e87ef06.jpg,,keynote-1-newton-rex,https://ismir2024.slack.com/archives/C0805NPRK8A,https://us02web.zoom.us/j/81805661292?pwd=ZZKs8fVNlmJb9zuDHVFQEDshAOcDeG.1
