uid,title,day,start_date,start_time,end_time,category,description,organiser,organiser_emails,organiser_affiliation,organiser_bio,image,web_link,slack_channel,channel_url,Zoom link
26,Poster Session - 2,2,2024-11-11,15:15,16:45,Poster session,"**In-person presentations:**

* [Six Dragons Fly Again: Reviving 15th-Century Korean Court Music with Transformers and Novel Encoding - Danbinaerin Han (KAIST), Mark R H Gotham (Durham), DongMin Kim (Sogang University), Hannah Park (Sogang University), Sihun Lee (Sogang University), Dasaem Jeong (Sogang University)*](/poster_35.html)
* [Lessons learned from a project to encode Mensural music on a large scale with Optical Music Recognition - David Rizo (University of Alicante. Instituto Superior de Enseñanzas Artísrticas de la Comunidad Valenciana)*, Jorge Calvo-Zaragoza (University of Alicante), Patricia García-Iasci (University of Alicante), Teresa Delgado-Sánchez (Biblioteca Nacional de España)](/poster_104.html)
* [The Changing Sound of Music: An Exploratory Corpus Study of Vocal Trends Over Time - Elena Georgieva (NYU)*, Pablo Ripollés (New York University), Brian McFee (New York University)](/poster_57.html)
* [Music Proofreading with RefinPaint: Where and How to Modify Compositions given Context - Pedro Ramoneda (Universitat Pompeu Fabra)*, Martín Rocamora (Universidad de la República), Taketo Akama (Sony CSL)](/poster_77.html)
* [Notewise Evaluation of Source Separation: A Case Study For Separated Piano Tracks - Yigitcan Özer (International Audio Laboratories Erlangen)*, Hans-Ulrich Berendes (International Audio Laboratories Erlangen), Vlora Arifi-Müller (International Audio Laboratories Erlangen ), Fabian-Robert Stöter (AudioShake, Inc.), Meinard Müller (International Audio Laboratories Erlangen)](/poster_13.html)
* [Automatic Estimation of Singing Voice Musical Dynamics - Jyoti Narang (Student)*, Nazif Can Tamer (Universitat Pompeu Fabra), Viviana De La Vega (Escola Superior de Música de Catalunya), Xavier Serra (Universitat Pompeu Fabra )](/poster_296.html)
* [Joint Audio and Symbolic Audio Conditioning For Temporally Controlled Text-to-Music Generation - Or Tal (The Hebrew University of Jerusalem)*, Alon Ziv (The Hebrew University of Jerusalem), Felix Kreuk (Bar-Ilan University), Itai Gat (Meta), Yossi Adi (The Hebrew University of Jerusalem)](/poster_65.html)
* [DIFF-A-RIFF: MUSICAL ACCOMPANIMENT CO-CREATION VIA LATENT DIFFUSION MODELS - Javier Nistal (Sony CSL)*, Marco Pasini (Queen Mary University of London), Cyran Aouameur  (Sony CSL), Stefan Lattner (Sony Computer Science Laboratories, Paris), Maarten Grachten (Machine Learning Consultant)](/poster_225.html)
* [Exploring Internet Radio Across the Globe with the MIRAGE Online Dashboard - Ngan V.T. Nguyen (University of Science, Vietnam Nation University Ho Chi Minh City), Elizabeth A.M. Acosta (Texas Tech University), Tommy Dang (Texas Tech University), David R.W. Sears (Texas Tech University)*](/poster_334.html)
* [The Sound Demixing Challenge 2023 – Cinematic Demixing Track - Stefan Uhlich, Giorgio Fabbro*, Masato Hirano, Shusuke Takahashi, Gordon Wichern, Jonathan Le Roux, Dipam Chakraborty, Sharada Mohanty, Kai Li, Yi Luo, Jianwei Yu, Rongzhi Gu, Roman Solovyev, Alexander Stempkovskiy, Tatiana Habruseva, Mikhail Sukhovei, Yuki Mitsufuji](/poster_511.html)
* [MIDI-to-Tab: Guitar Tablature Inference via Masked Language Modeling - Andrew C Edwards (QMUL)*, Xavier Riley (C4DM), Pedro Pereira Sarmento (Centre for Digital Music), Simon Dixon (Queen Mary University of London)](/poster_175.html)
* [Transcription-based lyrics embeddings: simple extraction of effective lyrics embeddings from audio - Jaehun Kim (Pandora / SiriusXM)*, Florian Henkel (SiriusXM + Pandora), Camilo Landau (Pandora / SiriusXM), Samuel E. Sandberg (SiriusXM + Pandora), Andreas F. Ehmann (SiriusXM + Pandora)](/poster_365.html)
* [A Method for MIDI Velocity Estimation for Piano Performance by a U-Net with Attention and FiLM - Hyon Kim (Universitat Pompeu Fabra)*, Xavier Serra (Universitat Pompeu Fabra )](/poster_42.html)
* [MusiConGen: Rhythm and Chord Control for Transformer-Based Text-to-Music Generation - Yun-Han Lan (Taiwan AI Labs)*, Wen-Yi Hsiao (Taiwan AI Labs), Hao-Chung Cheng (National Taiwan University), Yi-Hsuan Yang (National Taiwan University)](/poster_91.html)
* [End-to-end Piano Performance-MIDI to Score Conversion with Transformers - Tim Beyer (Technical University of Munich)*, Angela Dai (Technical University of Munich)](/poster_158.html)
* [From Real to Cloned Singer Identification - Dorian Desblancs (Deezer Research)*, Gabriel Meseguer Brocal (Deezer), Romain Hennequin (Deezer Research), Manuel Moussallam (Deezer)](/poster_271.html)
* [Emotion-driven Piano Music Generation via Two-stage Disentanglement and Functional Representation - Jingyue Huang (New York University)*, Ke Chen (University of California San Diego), Yi-Hsuan Yang (National Taiwan University)](/poster_376.html)
* [EFFICIENT ADAPTER TUNING FOR JOINT SINGING VOICE BEAT AND DOWNBEAT TRACKING WITH SELF-SUPERVISED LEARNING FEATURES - Jiajun Deng (The Chinese University of HongKong)*, Yaolong Ju (Huawei), Jing Yang (Huawei 2012 Labs), Simon Lui (Huawei), Xunying Liu (The Chinese University of Hong Kong)](/poster_48.html)
* [Which audio features can predict the dynamic musical emotions of both composers and listeners? - Eun Ji Oh (KAIST), Hyunjae Kim (KAIST), Kyung Myun Lee (KAIST)*](/poster_305.html)
* [Exploring Musical Roots: Applying Audio Embeddings to Empower Influence Attribution for a Generative Music Model - Julia Barnett (Northwestern University)*, Bryan Pardo (Northwestern University), Hugo Flores García (Northwestern University)](/poster_81.html)
",Anna Kruspe,,,,,,session-chatter,https://ismir2024.slack.com/archives/C07V56WJC07,
27,Listening For Diversity: The ways in which critical attention to words helps move us closer towards realizing our full humanity,2,2024-11-11,16:45,17:45,All Meeting,"Using her experience as a dancer, therapist, mediator, diversity trainer, anthropologist, college educator, and originator of Grounded Knowledge Panels®, Valerie Joseph distills lessons learned about the power of intentional and principled listening. She offers ideas on how to harness the energy derived from listening differently to fuel the capacity to have uncomfortable, rich, dynamic and productive thinking. This forms the basis upon which we are challenged to make transformative choices about how we operate with those other humans with whom we share the planet.",Valerie Joseph,,,"Valerie Joseph earned a Ph.D. in Cultural Anthropology from the University of Massachusetts at Amherst. Her doctoral research investigated the enduring legacies of British colonialism and African heritage memory among the members of the African Diaspora in Carriacou, Grenada. Specifically, she mapped how the game songs and dance play of Carriacouan Black girls as well as their words, beliefs, and attitudes reflected both the detrimental internalization of colonial ideology and the restorative nature of African retentions.

Prior to her fieldwork in Carriacou, Dr. Joseph lived and worked in Botswana for seven years starting as a Peace Corps Volunteer science teacher in a junior secondary school, then as a training coordinator at the Cheshire Foundation's Mogoditshane Rehabilitation Center. She closed out her years in the country by working as co-director of the School for International Training's college semester abroad program. During her time in Botswana, Dr. Joseph sharpened her interest in cross-cultural conflicts, including those that seemed to be intractable, though traceable, in part, to cultural mores as well as historical and social patterns embedded in racial or ethnic bias and discrimination.

Dr. Joseph has a Masters in Movement Therapy with a concentration in counseling psychology and a Masters in Social Justice Education. Her supplemental training, work and experience in several fields includes gymnastics coaching, dance performance, diversity training, Authentic Movement (a contemplative dance form), mediation, teaching and management in higher education.

Dr. Joseph is an educator-interventionist working at Smith College as the Mentoring Administrative Director for AEMES (Achieving Excellence in Math Engineering and Science). In that role, she manages programs to support the most marginalized students who are pursuing STEM. She also teaches college success seminars within the AEMES Scholars Program.

Dr. Joseph is co-founder of the Smith Roundtable Group. Started in 2020, the SRG is a small contingent of staff, faculty, and students dedicated to creating opportunities for information sharing and conversation about important current events. Past Roundtable offerings included: “Daring to be Hopeful: A Critical Response to the White Supremacist Storming of Our Capitol” and “Why is the Power of Young People so Threatening to the Status Quo?” The most recent Roundtable event took place in September of this year: ""'Calling In' for Democracy and Human Rights: A Consideration of Project 2025.""

In and outside of Smith, Dr. Joseph convenes a unique form of public discourse that she originated. Grounded Knowledge Panels® are public conversations by small groups of people who have realistic, authentic and personal experience and understanding of a particular topic or question. Emerging from core Black culture, Grounded Knowledge Panels are a synthesis of Dr. Joseph's study and work in various fields including anthropology, Authentic Movement, education and mediation. As panelists converse among themselves, audience members are invited as “witnesses” to observe the discussion. Both groups \- panelists and witnesses – bring a distinctive power, depth and responsibility to the experience of speaking and listening.

Dr. Joseph is a five time recipient of the Smith College Spotlight Award, an honor presented to staff members, chosen by peers, in appreciation of exceptional service. She is a 2020 recipient of the Elizabeth B. Wyant Gavel Award awarded by students to staff members who have performed outstanding work in the Smith community.

Dr. Joseph's first children's book, [This is What Maisie Believes](https://www.groundedspaceconsulting.com/books), is published by 619 Wreath Publishing.",https://confcats-siteplex.s3.us-east-1.amazonaws.com/ismir24/small_valerie_j_6510850013.png,,keynote-dei-joseph,https://ismir2024.slack.com/archives/C07VD4K0CJ2,https://us02web.zoom.us/j/81805661292?pwd=ZZKs8fVNlmJb9zuDHVFQEDshAOcDeG.1
28,Remembering Don Byrd,2,2024-11-11,17:45,18:00,Special Session,"Don Byrd, the General Chair of the very first ISMIR conference in 2000, has recently left us. This session remembers and celebrates the vision and contributions of this legend for our community. ",Zhiyao Duan,,,,,,remembering-don-byrd,https://ismir2024.slack.com/archives/C07VARAKF5J,https://us02web.zoom.us/j/81805661292?pwd=ZZKs8fVNlmJb9zuDHVFQEDshAOcDeG.1
29,Online special session I,2,2024-11-11,18:00,19:00,Special Session,"Join us for short presentations and informal conversations with invited researchers from the MIR community\!

**Amanda Krause**

Title: Can we categorise younger adult listeners?

Abstract: The evolution of digital listening technologies continues to impact the way we think about music consumption and music listening practices. Krause and North’s (2016) findings suggest that, in addition to demographic characteristics, psychological constructs should be considered when investigating listening practices and technology use. The present study uses latent profile analysis (LPA), which is a statistical technique that focuses on identifying latent subgroups within a population based on a set of variables. With this study, LPA affords us the opportunity to attempt to categorise types of music listeners. To explore this possibility, we draw on data collected from a sample of 584 younger adults residing in Australia (Mage \= 19.62; 74.10% female). Participants were asked to complete an online questionnaire that included demographics, the musicianship module of the MUSEBAQ (Chin, et al., 2018), the Music Engagement Test (MET; Greenberg & Rentfrow, 2015), Langford’s (2003) Big Five proxy personality scale, Krause and Hargreave’s (2013) Music Self-Images Questionnaire, and Krause and Brown’s (2021) format use measure. With analyses underway, preliminary indications suggest that format use and MET scores may differentiate listener typologies. Study findings further our theoretical understanding of how individuals consume music in everyday life.


**Sebastian Stober**

Title: ""Generative AI Training and Copyright Law”

Abstract: Training generative AI models requires extensive amounts of data. A common practice is to collect such data through web scraping. In the USA, AI developers rely on ""fair use"" and in Europe, the prevailing view is that the exception for ""Text and Data Mining"" (TDM) applies. In a recent interdisciplinary tandem-study with a legal expert, I have argued in detail that this is actually not the case because generative AI training fundamentally differs from TDM. In this talk, I will share our main findings and the implications for both public and corporate research on generative models. I will further discuss how the phenomenon of training data memorization leads to copyright issues independently from the ""fair use"" and TDM exceptions. Finally, I would like to outline how the ISMIR could contribute to the ongoing discussion about fair practices with respect to generative AI that satisfy all stakeholders.","Amanda Krause, Sebastian Stober",,,"**Dr Amanda E. Krause** is a Senior Lecturer (Psychology) in the College of Healthcare Sciences at James Cook University (Queensland, Australia). As a music psychology scholar based at James Cook University, she studies how we experience music in our everyday lives.
Her passion for researching the social and applied psychology of music has led her to give guest lectures and public talks and serve as President of the Australian Music & Psychology Society (AMPS). She is the author of numerous peer-reviewed academic publications and has spoken on her research to academics and industry leaders at conferences around the world. Her research has made significant contributions to understanding how listening technologies influence people’s experiences and how musical engagement impacts well-being. Dr Krause’s current programs of research concern how everyday music and radio experiences influence people’s well-being.

**Sebastian Stober** is professor for Artificial Intelligence at the Otto-von-Guericke-University Magdeburg, Germany. He studied computer science with focus on intelligent systems in Magdeburg until 2005 and received his PhD with distinction on the topic of adaptive methods for user-centered organization of music collections in 2011\. From 2013 to 2015, he was postdoctoral fellow at the Brain and Mind Institute in London, Ontario where he pioneered deep learning techniques for studying brain activity during music perception and imagination. Afterwards, he was head of the Machine Learning in Cognitive Science Lab at the University of Potsdam, before returning to Magdeburg in 2018\. In his current research, he investigates and develops generative models for music and speech as well as methods to better understand what an artificial intelligence has learned and how it solves specific problems. To this end, he combines the fields of artificial intelligence and machine learning with cognitive neuroscience and music information retrieval.",,,session-chatter,https://ismir2024.slack.com/archives/C07V56WJC07,https://us02web.zoom.us/j/81805661292?pwd=ZZKs8fVNlmJb9zuDHVFQEDshAOcDeG.1
30,Banquet/Jam Session,2,2024-11-11,19:00,23:59,Social,"Get ready for an unforgettable night at the Regency Ballroom in the heart of San Francisco! Join us for a spectacular banquet featuring the incredible Will Baldes, a multi-instrumentalist jazz artist who will blow your mind with his talent. And don’t miss the infamous ISMIR Jam Session—where anything can happen and probably will!

Indulge in delicious food and drinks while mingling with fellow MIR researchers. We’ve got you covered with buses to whisk you away from the conference venue to the banquet, so you can focus on having a fantastic time. This is one night you won’t want to miss—bring your dancing shoes and your appetite for fun! 🎷🍷🍴🚌",,,,,,,,,
31,Online Q&A w/ volunteers,2,2024-11-11,20:00,20:30,Meetup,Having issues with Zoom or Slack? Need help navigating the conference program or materials? Virtual volunteers will be available to meet with you and answer any questions you may have!,,,,,,,help-desk,https://ismir2024.slack.com/archives/C07TPGHFWR0,https://us02web.zoom.us/j/81805661292?pwd=ZZKs8fVNlmJb9zuDHVFQEDshAOcDeG.1
40,Remembering Don Byrd,3,2024-11-12,5:45,6:00,time,,,,,,,,remembering-don-byrd,https://ismir2024.slack.com/archives/C07VARAKF5J,https://us02web.zoom.us/j/81805661292?pwd=ZZKs8fVNlmJb9zuDHVFQEDshAOcDeG.1
41,Online special session II,3,2024-11-12,6:00,7:00,Special Session,"Join us for short presentations and informal conversations with invited researchers from the MIR community\!

**Martin Hartmann**

Title: Music and Movement: exploring Social and Multimodal Dimensions of Rhythmic Entrainment.

Abstract: The talk addresses key challenges in the field of music and movement through two ongoing studies at the Centre of Excellence in Music, Mind, Body and Brain at the University of Jyväskylä. The first challenge explores rhythmic-social entrainment within the context of free dyadic dance. We present a study that examines the relationship between rhythmic-social entrainment and social as well as musical affiliation during adolescence, using markerless motion capture technology. Following a 2x2 factorial design, participants dance freely in dyads with a friend and with a stranger to music of their choice and to music selected by us. The second challenge focuses on the multimodality of rhythmic-social entrainment. We discuss a study that employs motion capture and surface electromyography to investigate the impact of visual cues and performed activities on acoustic features, physiological responses, and kinematic responses in choir singing. The goal is to understand how the visibility of other choir members and the performed activities (chat, homophony, polyphony, and musical improvisation) influence different types of individual and group responses. In addition to exploring the social aspects of rhythmic entrainment in dance and its multimodal nature in choir singing, we emphasize the extraction of musical features and individual and social acoustic and kinematic features. We also consider potential take-home messages from these studies for the music information retrieval community and beyond.




**Kathleen Rose Agres** 
Session II: 6 AM PT, 12th November, Online - ISMIR 2024

Title: Affective music generation for emotion regulation in listeners

Abstract: There has been a surge of interest in automatic music generation in recent years, particularly in affective music generation. Numerous systems now offer controllable AI-based affective music generation (AI-AMG), as highlighted in Dash & Agres (2024). While these systems have been developed for various applications—including soundtrack creation in gaming and virtual reality, co-creativity, and health and well-being—this talk focuses on the use of AI-AMG to support emotion regulation in listeners. One such system, AffectMachine (Agres, Dash, & Chua, 2023), is designed to generate affective music in real time, and is capable of composing in both classical and pop-music styles. Recent findings across several studies demonstrate AffectMachine’s efficacy in producing music perceived as emotional and capable of inducing emotions, as shown by subjective emotion ratings and physiological responses. This talk will explore the implications of systems like AffectMachine for supporting emotion self-regulation.




Kaustuv Kanti Ganguli
Session II: 6 AM PT, 12th November, Online - ISMIR 2024

Title: Harmonic Convergence: Orchestrating the Synergy of Human Intuition and Machine Intelligence in Music

Abstract: In the rapidly evolving landscape of computational musicology, we stand at a fascinating crossroads where human perception intertwines with machine-driven analysis. This convergence offers unprecedented opportunities to unravel the complexities of musical structures, particularly in rich non-Eurogenetic traditions such as Indian art music. By harmonizing human cognition with artificial intelligence, we can decode the intricate artifacts of audio signal processing, revealing new dimensions in our understanding of music. This approach not only enhances our appreciation of musical nuances but also challenges us to rethink the boundaries between human creativity and computational analysis. 

As we navigate this confluence, we must consider the profound implications for music education, composition, and appreciation. How can we leverage machine learning to augment human musical intuition? What new insights into musical cognition can emerge from this synthesis? By exploring these questions, we open doors to innovative pedagogical tools, more nuanced music recommendation systems, and perhaps even new forms of musical expression. The future of music analysis lies not in choosing between human expertise and artificial intelligence but in orchestrating a symphony where both play in perfect harmony, each enhancing the other's strengths and compensating for limitations.",Martin Hartmann,,,"**Martin Hartmann** is an Assistant Professor of Musicology at the University of Jyväskylä, where he works for the Centre of Excellence in Music, Mind, Body, and Brain and for the European Research Council project MUSICONNECT. His research encompasses music and movement, perception, information retrieval, and therapy. Currently, he specializes in the computational modeling of multimodal interactions in music and dance contexts. He is an executive group member of the Finnish Doctoral Network for Music Research and the local coordinator of the EU-funded FORTHEM Alliance Lab for Arts and Aesthetics in Contemporary Society. He led the project “Interaction in Music Therapy for Depression”, maintains the MoCap (Motion Capture) Toolbox for MATLAB, and holds editorial roles for the journals *Music Perception* and *Psychology of Music*.

**Dr. Kat Agres** is an Assistant Professor at the Yong Siew Toh Conservatory of Music at the National University of Singapore (NUS), and Founding Director of the Centre for Music and Health, the first dedicated research centre in Southeast Asia to spearhead evidence-based research leveraging the efficacy of music for health and well-being. Kat received her PhD in Cognitive Psychology from Cornell University and completed her postdoctoral fellowships in Music Cognition and Computational Creativity at the University of London. She also holds a bachelor's degree in Cello Performance and Psychology from Carnegie Mellon University. Kat’s research explores music interventions and technologies for healthcare and well-being, music perception and cognition, and computational creativity. She has received numerous grants to support her research in Singapore, the US, and UK. Kat has presented her research in over twenty countries around the world, and has also performed professionally as a cellist.

**Dr. Kaustuv Kanti Ganguli** is an Associate Professor of Artificial Intelligence at Zayed University and a Scholar at New York University Abu Dhabi Scholar, spearheading computational musicology and machine learning research. His innovative work bridges AI and music, focusing on Arabian Gulf and South Indian repertoires. Dr. Ganguli develops AI models that enhance music understanding, preservation, and education by combining engineering approaches with human cognition. A President's Gold Medal recipient and accomplished Hindustani vocal performer, his expertise spans machine learning, virtual reality, and audio processing. His groundbreaking projects include Raga/Makam characterization, multi-sensory perception, and crossmodal correspondence that collectively foster a deeper appreciation for diverse musical traditions through the lens of artificial intelligence. Kaustuv envisions blending humanistic and computational methods in a cross-disciplinary environment within a liberal arts framework, focusing on cutting-edge research and sustainable, innovative teaching.",,,session-chatter,https://ismir2024.slack.com/archives/C07V56WJC07,https://us02web.zoom.us/j/81805661292?pwd=ZZKs8fVNlmJb9zuDHVFQEDshAOcDeG.1
42,Registration,3,2024-11-12,8:00,8:30,Registration,,,,,,,,,,
43,Online Q&A w/ volunteers,3,2024-11-12,8:00,8:30,Meetup,Having issues with Zoom or Slack? Need help navigating the conference program or materials? Virtual volunteers will be available to meet with you and answer any questions you may have!,,,,,,,help-desk,https://ismir2024.slack.com/archives/C07TPGHFWR0,https://us02web.zoom.us/j/81805661292?pwd=ZZKs8fVNlmJb9zuDHVFQEDshAOcDeG.1
,,,,,,,,,,,,,,,,
