UID,day,session,position,paper_presentation,long_presentation,title,Abstract,primary_author,authors_and_affil,authors,primary_subject,secondary_subject,SpecialTrack,abstract_short,StudentAuthor,StudentAuthor.1,AwardNominee,pdf_path,video,poster_pdf,thumbnail,slides_pdf,channel_url,slack_channel
306,2,4,17,San Francisco,FALSE,Stem-JEPA: A Joint-Embedding Predictive Architecture for Musical Stem Compatibility Estimation,"This paper explores the automated process of determining stem compatibility by identifying audio recordings of single instruments that blend well with a given musical context. To tackle this challenge, we present Stem-JEPA, a novel Joint-Embedding Predictive Architecture (JEPA) trained on a multi-track dataset using a self-supervised learning approach.  Our model comprises two networks: an encoder and a predictor, which are jointly trained to predict the embeddings of compatible stems from the embeddings of a given context, typically a mix of several instruments. Training a model in this manner allows its use in estimating stem compatibility—retrieving, aligning, or generating a stem to match a given mix—or for downstream tasks such as genre or key estimation, as the training paradigm requires the model to learn information related to timbre, harmony, and rhythm.  We evaluate our model’s performance on a retrieval task on the MUSDB18 dataset, testing its ability to find the missing stem from a mix and through a subjective user study. We also show that the learned embeddings capture temporal alignment information and, finally, evaluate the representations learned by our model on several downstream tasks, highlighting that they effectively capture meaningful musical features.",Gaëtan Hadjeres,"Alain Riou (Sony CSL Paris); Stefan Lattner (Sony Computer Science Laboratories, Paris); Gaëtan Hadjeres (Sony CSL)*; Michael Anslow (Sony Computer Science Laboratories, Paris); Geoffroy Peeters (LTCI - Télécom Paris, IP Paris)","Riou, Alain; Lattner, Stefan; Hadjeres, Gaëtan*; Anslow, Michael; Peeters, Geoffroy",Knowledge-driven approaches to MIR -> machine learning/artificial intelligence for music,Knowledge-driven approaches to MIR -> representations of music; Musical features and properties; Musical features and properties -> representations of music,,,,,No,https://drive.google.com/file/d/1nlqY1ruyjVURT8cD0cH5Avzhdz5JDGQO/view?usp=drive_link,https://drive.google.com/file/d/13Tz5oxvfM9iJaOQQyYS64smicMkURT3e/view?usp=sharing,https://drive.google.com/file/d/1WSTUYMmEIA5COiQycZITf_3HGiPp85Fp/view?usp=drive_link,https://drive.google.com/file/d/1Y6n_osKu4o_VOQizLTcrCaOc-bk_TJbT/view?usp=drive_link,https://docs.google.com/presentation/d/17buqdziLcdsasUgAUhRhJN1aIHpUA0I-i5kGw47npTo/edit?usp=sharing,https://ismir2024.slack.com/archives/C07USGP2VN0,p4-17-stem-jepa-a
315,4,7,2,San Francisco,FALSE,CADENZA: A Generative Framework for Expressive Musical Ideas and Variations,"We introduce Cadenza, a new multi-stage generative framework for predicting expressive variations of symbolic musical ideas as well as unconditional generations. To accomplish this we introduce a novel MIDI encoding method, PerTok (Performance Tokenizer) that captures minute expressive details whilst maintaining short sequence length and vocabulary sizes for polyphonic, monophonic and rhythmic tasks. The proposed framework comprises two sequential stages: 1) Composer and 2) Performer. The Composer model is a transformer-based Variational Autoencoder (VAE), with Rotary Positional Embeddings (RoPE) and an autoregressive decoder modified to more effectively integrate the latent codes of the input musical idea. The Performer model is a bidirectional transformer encoder that is separately trained to predict velocities and microtimings on MIDI sequences. Extensive human evaluations demonstrate Cadenza's versatile capabilities in both meeting and surpassing the musical quality of other state-of-the-art symbolic models in unconditional generation, and secondly, composing new, expressive ideas that are both stylistically related to the input whilst providing novel ideas to the user. Our framework is designed, researched and implemented with the objective of ethically providing inspiration for musicians.",Anirudh Mani,Julian Lenz (Lemonaide ); Anirudh Mani (Lemonaide)*,"Lenz, Julian; Mani, Anirudh*","Applications -> music composition, performance, and production",Creativity -> human-ai co-creativity; Creativity -> tools for artists; Generative Tasks -> artistically-inspired generative tasks ; Generative Tasks -> transformations; Musical features and properties -> representations of music,,,,,No,https://drive.google.com/file/d/1Eg3tB-462vsXvSvZHSwJiBZBjiFeNofw/view?usp=drive_link,https://drive.google.com/file/d/1FWq2xYed6xqkDLhIsrTFfQvf6E2YhRol/view?usp=sharing,https://drive.google.com/file/d/1H-1dKOrp8XcAPWIJTjL0uNCZ7UtzVEOA/view?usp=drive_link,https://drive.google.com/file/d/1cEmfh9XOnZbv6zmv-30c5wj9eqsT_n9c/view?usp=drive_link,https://drive.google.com/file/d/1SQQWcdsjGlY7J2ExkmqTUAOdJvdWleIE/view?usp=drive_link,https://ismir2024.slack.com/archives/C07USJDDWHJ,p7-02-cadenza-a-generative
316,3,5,8,San Francisco,FALSE,Combining audio control and style transfer using latent diffusion,"Deep generative models are now able to synthesize high-quality audio signals, shifting the critical aspect in their development from audio quality to control capabilities. Although text-to-music generation is getting largely adopted by the general public, explicit control and example-based style transfer are more adequate modalities to capture the intents of artists and musicians.   In this paper, we aim to unify explicit control and style transfer within a single model by separating local and global information to capture musical structure and timbre respectively. To do so, we leverage the capabilities of diffusion autoencoders to extract semantic features, in order to build two representation spaces. We enforce disentanglement between those spaces using an adversarial criterion and a two-stage training strategy. Our resulting model can generate audio matching a timbre target, while specifying structure either with explicit controls or through another audio example. We evaluate our model on one-shot timbre transfer and MIDI-to-audio tasks on instrumental recordings and show that we outperform existing baselines in terms of audio quality and target fidelity. Furthermore, we show that our method can generate cover versions of complete musical pieces by transferring rhythmic and melodic content to the style of a target audio in a different genre.",Nils Demerlé,Nils Demerlé (IRCAM)*; Philippe  Esling (IRCAM); Guillaume Doras (Ircam); David Genova (Ircam),"Demerlé, Nils*; Esling, Philippe ; Doras, Guillaume; Genova, David",Generative Tasks -> music and audio synthesis,"Applications -> music composition, performance, and production; Creativity -> tools for artists; Generative Tasks -> artistically-inspired generative tasks ; Generative Tasks -> interactions; Generative Tasks -> transformations",,,,,No,https://drive.google.com/file/d/14OoxZjA_1WmLAWntlWCimXWXb87q8lU_/view?usp=drive_link,https://drive.google.com/file/d/1f9uMz_tRnnTpj-_TFScB7IMZIw4J-4R4/view?usp=drive_link,https://drive.google.com/file/d/1t8X5IzAD2SbYWxEnY8AFEWvUR_rJ7mEy/view?usp=drive_link,https://drive.google.com/file/d/1L4upF6s4rMeCJ-NfTBB5KZ1d3jmsNSQG/view?usp=drive_link,https://docs.google.com/presentation/d/1dThpwBYPxR7kyQICcDmqrZzuckKntKoh/edit?usp=drive_link&ouid=102045217384450827259&rtpof=true&sd=true,https://ismir2024.slack.com/archives/C07USGP5JMA,p5-08-combining-audio-control
317,2,3,6,San Francisco,FALSE,The ListenBrainz Listens Dataset,"The ListenBrainz listens dataset is a continually evolv- ing repository of music listening history events submitted by all ListenBrainz users. Currently totalling over 800 million entries, each datum within the dataset encapsu- lates a timestamp, a pseudonymous user identifier, track metadata, and optionally MusicBrainz identifiers facilitat- ing seamless linkage to external resources and datasets. This paper discusses the process of raw data acquisition, the subsequent steps of data synthesis and cleaning, the comprehensive contents of the refined dataset, and the di- verse potential applications of this invaluable resource. Al- though not the largest dataset in terms of music listening events (yet), its distinctiveness lies in its perpetual evolu- tion, with users contributing data daily. This paper under- scores the significance of the ListenBrainz listens dataset as a significant asset for researchers and practitioners alike, offering insights into music consumption patterns, user preferences, and avenues for further exploration in the fields of music information retrieval and recommendation systems.",Kartik Ohri,Kartik Ohri (MetaBrainz Foundation Inc.)*; Robert Kaye (MetaBrainz Foundation Inc.),"Ohri, Kartik*; Kaye, Robert","Evaluation, datasets, and reproducibility -> novel datasets and use cases","Applications -> digital libraries and archives; Applications -> music recommendation and playlist generation; MIR fundamentals and methodology -> metadata, tags, linked data, and semantic web",,,,,No,https://drive.google.com/file/d/1Dng1gCcWZzhNoohvmfIeV0pjkcpcXvV3/view?usp=drive_link,https://drive.google.com/file/d/1n4It45Un21eMOFehfIeOYa-CPUpipUYH/view?usp=drive_link,https://drive.google.com/file/d/13M9Rm068n5C025eqBMzGE2lj360mL6ur/view?usp=drive_link,https://drive.google.com/file/d/1X4n3yRyuXSuY15IwllmlsgtdrMKk7xIm/view?usp=drive_link,https://drive.google.com/file/d/1d-ot4CXsh94NIqKdz_-QM1Xvm7Augymp/view?usp=drive_link,https://ismir2024.slack.com/archives/C07UPUHDYF5,p3-06-the-listenbrainz-listens
322,3,5,17,San Francisco,FALSE,RNBert: Fine-Tuning a Masked Language Model for Roman Numeral Analysis,"Music is plentiful, but labeled data for music theory tasks like roman numeral analysis is scarce. Self-supervised pretraining on unlabeled data is therefore a promising means of improving performance on these tasks, especially because, during pretraining, a model may be expected to acquire latent representations of musical abstractions like keys and chords. However, existing deep learning models for roman numeral analysis have not used pretraining, instead training from scratch on labeled data, while conversely, pretrained models for music understanding have generally been applied to sequence-level tasks not involving explicit music theory, like composer or genre classification. In contrast, this paper applies pretraining methods to a music theory task by fine-tuning a masked language model, MusicBERT, for roman numeral analysis. We apply token classification to predict labels for each note, then aggregate the predictions of simultaneous notes to obtain a single label at each time step. Conditioning the chord predictions on key predictions gives more coherent labels. The resulting model outperforms previous roman numeral analysis models by a substantial margin.",Malcolm Sailor,Malcolm Sailor (Yale University)*,"Sailor, Malcolm*",Knowledge-driven approaches to MIR -> machine learning/artificial intelligence for music,"Computational musicology; Knowledge-driven approaches to MIR -> computational music theory and musicology; MIR fundamentals and methodology -> symbolic music processing; MIR tasks -> automatic classification; Musical features and properties -> harmony, chords and tonality",,,,,No,https://drive.google.com/file/d/1Gqyk2QoOrzJXOPd_LBgchAsnBDJxG6cz/view?usp=drive_link,https://drive.google.com/file/d/101uolZhDyW2dpOhoPqlgfgy_uM_kyBIu/view?usp=drive_link,https://drive.google.com/file/d/1shpkSE2PSIr-u-vcBxTryredYcCwPBRu/view?usp=drive_link,https://drive.google.com/file/d/1wLkwNpEi0tli-WbJLSHEaU8B3vOOW9zn/view?usp=drive_link,https://drive.google.com/file/d/1eQ98oLd0j47TFttCKB-4fd2oN6erU1AQ/view?usp=drive_link,https://ismir2024.slack.com/archives/C07UHCXAFE2,p5-17-rnbert-fine-tuning
326,1,1,15,San Francisco,FALSE,Automatic Detection of Moral Values in Music Lyrics,"Moral values play a fundamental role in how we evaluate information, make decisions, and form judgements around important social issues. The possibility to extract morality rapidly from lyrics enables a deeper understanding of our music-listening behaviours. Building on the Moral Foundations Theory (MFT), we tasked a set of transformer-based language models (BERT) fine-tuned on 2,721 synthetic lyrics generated by a large language model (GPT-4) to detect moral values in 200 real music lyrics annotated by two experts. We evaluate their predictive capabilities against a series of baselines including out-of-domain (BERT fine-tuned on MFT-annotated social media texts) and zero-shot (GPT-4) classification. The proposed models yielded the best accuracy across experiments, with an average F1 weighted score of 0.8. This performance is, on average, 5% higher than out-of-domain and zero-shot models. When examining precision in binary classification, the proposed models perform on average 12% higher than the baselines. Our approach contributes to annotation-free and effective lyrics morality learning, and provides useful insights into the knowledge distillation of LLMs regarding moral expression in music, and the potential impact of these technologies on the creative industries and musical culture.",Vjosa Preniqi,Vjosa Preniqi (Queen Mary University of London)*; Iacopo Ghinassi (Queen Mary University of London); Julia Ive (Queen Mary University of London); Kyriaki Kalimeri (ISI Foundation); Charalampos Saitis (Queen Mary University of London),"Preniqi, Vjosa*; Ghinassi, Iacopo; Ive, Julia; Kalimeri, Kyriaki; Saitis, Charalampos",MIR fundamentals and methodology -> lyrics and other textual data,"Knowledge-driven approaches to MIR -> machine learning/artificial intelligence for music; MIR fundamentals and methodology -> web mining, and natural language processing",,,,,No,https://drive.google.com/file/d/1nTVfYNUTeLcioLm6T1-A3cCtG9ElEAVF/view?usp=drive_link,https://drive.google.com/file/d/1EfbWaqUcxnOqSdVEvL2HZbeoWe2FN7sA/view?usp=drive_link,https://drive.google.com/file/d/1p0hDd03EtOchCgOQqB92j0bjd7Jy64Zy/view?usp=drive_link,https://drive.google.com/file/d/1Eiz0NkthEE7ejBxQ_Z6CA558SfE8LCbr/view?usp=drive_link,https://docs.google.com/presentation/d/14v-IGWiLgrQDmUQTbK2q1mGxBTdK0SjO/edit?usp=drive_link&ouid=102045217384450827259&rtpof=true&sd=true,https://ismir2024.slack.com/archives/C07UHCXC8T0,p1-15-automatic-detection-of
328,1,1,3,San Francisco,FALSE,X-Cover: Better music version identification system by integrating pretrained ASR model,"Methods based on deep learning have emerged as a dominant approach for cover song identification (CSI) literature over the past years, among which ByteCover systems have consistently delivered state-of-the-art performance across major CSI datasets in the field. Despite its steady improvements along previous generations from audio feature dimensionality reduction to short query identification, the system is found to be vulnerable to audios with noise and ambiguous melody when extracting musical information from constant-Q transformation (CQT) spectrograms. Although some recent studies suggest that incorporating lyric-related features can enhance the overall performance of CSI systems, this approach typically requires training a separate automatic lyric recognition (ALR) model to extract lyric-related features from music recordings. In this work, we introduce X-Cover, the latest CSI system that incorporates a pre-trained automatic speech recognition (ASR) module, Whisper, to extract and integrate lyrics-related features into modelling. Specifically, we jointly fine-tune the ASR block and the previous ByteCover3 system in a parameter-efficient fashion, which largely reduces the cost of using lyric information compared to training a new ALR model from scratch. In addition, a bag of tricks is further applied to the training of this new generation, assisting X-Cover to achieve strong performance across various datasets.",Xingjian Du,Xingjian Du (University of Rochester)*; Zou Pei (ByteDance); Mingyu Liu (ByteDance); Xia Liang (Bytedance); Huidong Liang (University of Oxford); Minghang Chu (Bytedance); Zijie Wang (ByteDance); Bilei Zhu (ByteDance AI Lab),"Du, Xingjian*; Pei, Zou; Liu, Mingyu; Liang, Xia; Liang, Huidong; Chu, Minghang; Wang, Zijie; Zhu, Bilei",Applications -> music retrieval systems,MIR tasks -> indexing and querying,,,,,No,https://drive.google.com/file/d/1OYqi9OjSIDEdoCORyvwZtlLMoR06XX7v/view?usp=drive_link,https://drive.google.com/file/d/1qQLxjsDFUM2eXJwZ6G5xujt-sOOJyZds/view?usp=drive_link,https://drive.google.com/file/d/1jFLymUg1dk9CMr4TBpvXjKe-6a_mF6nk/view?usp=drive_link,https://drive.google.com/file/d/1WQoRrfp2BSluPa2zVtN00s9RH1W91rz0/view?usp=drive_link,https://drive.google.com/file/d/1YnJAkXMbqFrAjWsxTwjl2bHm7ga_su6H/view?usp=drive_link,https://ismir2024.slack.com/archives/C07UM62QLTX,p1-03-x-cover-better
333,3,6,1,San Francisco,TRUE,MuChoMusic: Evaluating Music Understanding in Multimodal Audio-Language Models,"Multimodal models that jointly process audio and language hold great promise in audio understanding and are increasingly being adopted in the music domain. By allowing users to query via text and obtain information about a given audio input, these models have the potential to enable a variety of music understanding tasks via language-based interfaces. However, their evaluation poses considerable challenges, and it remains unclear how to effectively assess their ability to correctly interpret music-related inputs with current methods. Motivated by this, we introduce MuChoMusic, a benchmark for evaluating music understanding in multimodal language models focused on audio. MuChoMusic comprises 1,187 multiple-choice questions, all validated by human annotators, on 644 music tracks sourced from two publicly available music datasets, and covering a wide variety of genres. Questions in the benchmark are crafted to assess knowledge and reasoning abilities across several dimensions that cover fundamental musical concepts and their relation to cultural and functional contexts. Through the holistic analysis afforded by the benchmark, we evaluate five open-source models and identify several pitfalls, including an over-reliance on the language modality, pointing to a need for better multimodal integration. Data and code are open-sourced.",Benno Weck,"Benno Weck (Music Technology Group, Universitat Pompeu Fabra (UPF))*; Ilaria Manco (Queen Mary University of London); Emmanouil Benetos (Queen Mary University of London); Elio Quinton (Universal Music Group); George Fazekas (QMUL); Dmitry Bogdanov (Universitat Pompeu Fabra)","Weck, Benno*; Manco, Ilaria; Benetos, Emmanouil; Quinton, Elio; Fazekas, George; Bogdanov, Dmitry","Evaluation, datasets, and reproducibility -> novel datasets and use cases","MIR fundamentals and methodology -> lyrics and other textual data; MIR fundamentals and methodology -> multimodality; MIR fundamentals and methodology -> web mining, and natural language processing",,,,,Yes,https://drive.google.com/file/d/18Sd4DvX2-GSRybRgjk5jRdHNTixovPlX/view?usp=sharing,https://drive.google.com/file/d/1_mWEFUkb6g2TTWt6ZKNBk9KW0dQeIV2C/view?usp=drive_link,https://drive.google.com/file/d/1Au9_Bg1lF0KETm2fsN7GLRHfOStXgpkJ/view?usp=drive_link,https://drive.google.com/file/d/15IJY9NC5AT1ZXABUF19nPDH21FVRClQJ/view?usp=drive_link,https://drive.google.com/file/d/1h7Xi18AmfnJ-B6fCPoLChti337L_JLZG/view?usp=drive_link,https://ismir2024.slack.com/archives/C07V2PM1SP3,p6-01-muchomusic-evaluating-music
334,1,2,9,San Francisco,FALSE,Exploring Internet Radio Across the Globe with the MIRAGE Online Dashboard,"This study presents the Music Informatics for Radio Across the GlobE (MIRAGE) online dashboard, which allows users to access, interact with, and export metadata (e.g., artist name, song title) and musicological features (e.g., instrument list, voice type, key/mode) for 1 million songs streaming on 10,000 internet radio stations across the globe. Users can search for stations or songs according to several criteria, display, analyze, and listen to the selected station/song lists using interactive visualizations that include embedded links to streaming services, and finally export relevant metadata and visualizations for further study.",David Sears,"Ngan V.T. Nguyen (University of Science, Vietnam Nation University Ho Chi Minh City); Elizabeth A.M. Acosta (Texas Tech University); Tommy Dang (Texas Tech University); David R.W. Sears (Texas Tech University)*","Nguyen, Ngan V.T.; Acosta, Elizabeth; Dang, Tommy; Sears, David*",Human-centered MIR -> music interfaces and services,"Evaluation, datasets, and reproducibility -> novel datasets and use cases; Knowledge-driven approaches to MIR -> cognitive MIR; Knowledge-driven approaches to MIR -> computational ethnomusicology; Knowledge-driven approaches to MIR -> computational music theory and musicology; Philosophical and ethical discussions -> ethical issues related to designing and implementing MIR tools and technologies",,,,,No,https://drive.google.com/file/d/1zyarHqwIq80cXUHwfW76uEwoJQEFKOnL/view?usp=sharing,https://drive.google.com/file/d/1l7YN-x0PXcnUosh5EZCv1x4PdzLjDOm6/view?usp=sharing,https://drive.google.com/file/d/1FTAAUOg4remtlKF9jW9kjJfsjP4opVeI/view?usp=sharing,https://drive.google.com/file/d/1aFqRSXlY6EzHKr0Cq_2YpTg7ztRCnA0X/view?usp=sharing,https://drive.google.com/file/d/1o1Vahu6E6_6KpH2icFoYCpR7bQrXW5r8/view?usp=share_link,https://ismir2024.slack.com/archives/C07UQ1NQZMY,p2-09-exploring-internet-radio
335,1,1,12,San Francisco,FALSE,Towards Automated Personal Value Estimation in Song Lyrics,"Most music widely consumed in Western Countries contains song lyrics, with U.S. samples reporting almost all of their song libraries contain lyrics. In parallel, social science theory suggests that personal values - the abstract goals that guide our decisions and behaviors - play an important role in communication: we share what is important to us to coordinate efforts, solve problems and meet challenges. Thus, the values communicated in song lyrics may be similar or different to those of the listener, and by extension affect the listener's reaction to the song. This suggests that working towards automated estimation of values in lyrics may assist in downstream MIR tasks, in particular, personlization. However, as highly subjective text, song lyrics present a challenge in terms of sampling songs to be annotated, annotation methods, and in choosing a method for aggregation. In this project, we take a perspectivist approach, guided by social science theory, to gathering annotations, estimating their quality, and aggregating them. We then compare aggregated ratings to estimates based on pre-trained sentence/word embedding models by employing a validated value dictionary. We discuss conceptually 'fuzzy' solutions to sampling and annotation challenges, promising initial results in annotation quality and in automated estimations, and future directions.",Andrew M. Demetriou,Andrew M. Demetriou (Delft University of Technology)*; Jaehun Kim (Pandora / SiriusXM); Cynthia Liem (Delft University of Technology),"Demetriou, Andrew M.*; Kim, Jaehun; Liem, Cynthia",MIR fundamentals and methodology -> lyrics and other textual data,"Evaluation, datasets, and reproducibility -> novel datasets and use cases",,,,,No,https://drive.google.com/file/d/1UNtJ-Tf6HmkqHZxoN178HyZbGWMMiRLH/view?usp=sharing,https://drive.google.com/file/d/10QODdTfivKPKUHNKsqQHtqYetjjVPpdg/view?usp=share_link,https://drive.google.com/file/d/1RzPyaKKiOooQhJgskFcMbTapg0OzSOeU/view?usp=share_link,https://drive.google.com/file/d/1ZOuRfzixPfpDKnYsXJl4XuO8GV7NeSsh/view?usp=share_link,https://drive.google.com/file/d/1UCq2oLD7HNDWMfAtKGigHhkuNj77vyAh/view?usp=share_link,https://ismir2024.slack.com/archives/C07UHCXJX0E,p1-12-towards-automated-personal
