UID,day,session,position,paper_presentation,long_presentation,title,Abstract,primary_author,authors_and_affil,authors,primary_subject,secondary_subject,SpecialTrack,abstract_short,StudentAuthor,StudentAuthor.1,AwardNominee,pdf_name,pdf_path,video,poster_pdf,thumbnail,slides_pdf,channel_url,slack_channel
77,1,2,4,San Francisco,FALSE,Music Proofreading with RefinPaint: Where and How to Modify Compositions given Context,"Autoregressive generative transformers are key in music generation, producing coherent compositions but facing challenges in human-machine collaboration. We propose RefinPaint, an iterative technique that improves the sampling process. It does this by identifying the weaker music elements using a feedback model, which then informs the choices for resampling by an inpainting model. This dual-focus methodology not only facilitates the machine's ability to improve its automatic inpainting generation through repeated cycles but also offers a valuable tool for humans seeking to refine their compositions with automatic proofreading.  Experimental results suggest RefinPaint's effectiveness in inpainting and proofreading tasks, demonstrating its value for refining music created by both machines and humans. This approach not only facilitates creativity but also aids amateur composers in improving their work.",Pedro Ramoneda,Pedro Ramoneda (Universitat Pompeu Fabra)*; Martín Rocamora (Universidad de la República); Taketo Akama (Sony CSL),"Ramoneda, Pedro*; Rocamora, Martín; Akama, Taketo",Creativity -> human-ai co-creativity,Creativity; Creativity -> creativity and learning; Generative Tasks; Generative Tasks -> interactions; MIR tasks -> music generation,,,,,No,https://drive.google.com/file/d/1ia2OxA9wgadP1SiWWYN7clsiaz9kJbmA/view?usp=drive_link,,https://drive.google.com/file/d/1Um81VNHusxHqoh84RQlMumaZmMxjGKSX/view?usp=drive_link,https://drive.google.com/file/d/1VGJLTy1natiGB5LEP1zOBPUmO6oVdVFm/view?usp=drive_link,https://drive.google.com/file/d/1MMgr2dhkmNjdfdcLItJes-4fwbYPNM3a/view?usp=drive_link,https://docs.google.com/presentation/d/1iYX8GBypuG0bKPD_Llf-D7Jf7t7bladrtw3YgKG7kHM/edit?usp=sharing,,
79,2,3,4,San Francisco,FALSE,Human-AI Music Process: A Dataset of AI-Supported Songwriting Processes from the AI Song Contest,"The advent of accessible artificial intelligence (AI) tools and systems has begun a new era for creative expression, challenging us to gain a better understanding of human-AI collaboration and creativity. In this paper, we introduce Human-AI Songwriting Processes Dataset (HAISP), consisting of 34 coded submissions from the 2023 AI Song Contest teams. This dataset offers a resource for exploring the complex dynamics of AI-supported songwriting processes, facilitating investigations into the possibilities and challenges posed by AI in creative endeavors. Overall, HAISP contributes to advancing understanding of human-AI co-creation from the users' perspective. Furthermore, we outline potential use cases for the dataset, ranging from analyzing AI tools utilized in songwriting to gaining insights into users' ethical considerations and expanding creative possibilities. This can help to inform both scholarly inquiry and practical applications in music composition and beyond.",Lidia J Morris,Lidia J Morris (University of Washington)*; Rebecca Leger (Fraunhofer IIS); Michele Newman (University of Washington); John Ashley Burgoyne (University of Amsterdam); Ryan Groves (Self-employed); Natasha Mangal (CISAC); Jin Ha Lee (University of Washington),"Morris, Lidia J*; Leger, Rebecca; Newman, Michele; Burgoyne, John Ashley; Groves, Ryan; Mangal, Natasha; Lee, Jin Ha",Creativity -> human-ai co-creativity,"Creativity -> computational creativity; Creativity -> creative practice involving MIR or generative technology ; Evaluation, datasets, and reproducibility -> novel datasets and use cases; Generative Tasks -> music and audio synthesis; Knowledge-driven approaches to MIR -> machine learning/artificial intelligence for music",,,,,No,https://drive.google.com/file/d/1VjFIWqMwUxnsBKdPsG3jok97RngcMBSQ/view?usp=drive_link,,https://drive.google.com/file/d/1Ple4x4zVPxCMeHRgnjA-WEE5OQt-epk3/view?usp=drive_link,https://drive.google.com/file/d/1GHUgD19TlzgmMjZSe60cgR2uMBZqGWqv/view?usp=drive_link,https://drive.google.com/file/d/1G7LXNeVNfho8g_TVWUYUFRe93En4BY-P/view?usp=drive_link,https://drive.google.com/file/d/1szcAXxXT5hLkybVhCS1F2XEH_6lc0VVa/view?usp=drive_link,,
83,2,4,4,San Francisco,FALSE,Purposeful Play: Evaluation and Co-Design of Casual Music Creation Applications with Children,"The rise of digital technologies has increased interest in democratizing music creation, but current creativity support tools often prioritize literacy and education over meeting children's needs for casual creation. To address this, we conducted Participatory Design sessions with children aged 6-13 to explore their perceptions of casual music creation activities and identify elements of creative applications that support different expressions. Our study aimed to answer two key questions: (1) How do children perceive casual music creation activities and which elements of creative applications facilitate expression? and (2) What insights can inform the design of future casual music creation tools? Our findings indicate that children view casual music creation as involving diverse activities, with visuals aiding in understanding sounds, and engaging in various playful interactions leading to creative experiences. We present design implications based on our findings and introduce casual creation as ""purposeful play"". Furthermore, we discuss its implications for creative MIR.",Michele Newman,Michele Newman (University of Washington)*; Lidia Morris (University of Washington); Jun Kato (National Institute of Advanced Industrial Science and Technology (AIST)); Masataka Goto (National Institute of Advanced Industrial Science and Technology (AIST)); Jason Yip (University of Washington); Jin Ha Lee (University of Washington),"Newman, Michele*; Morris, Lidia J; Kato, Jun; Goto, Masataka; Yip, Jason; Lee, Jin Ha",Creativity -> creativity and learning,Creativity -> creative practice involving MIR or generative technology ; Human-centered MIR -> human-computer interaction; Human-centered MIR -> music interfaces and services; Human-centered MIR -> user-centered evaluation,,,,,No,https://drive.google.com/file/d/1Iq4_tkuSSKZdUphnPm-8DtyKE4jFWk2N/view?usp=share_link,,https://drive.google.com/file/d/1mP85ID1OC1_QFZreMCh-HxUQOwbNZLQp/view?usp=share_link,https://drive.google.com/file/d/16URMaG7w64HLOG6njAm9UEc1GseMVYX1/view?usp=share_link,https://drive.google.com/file/d/11W7-Grx5vqLGGNfNTkRSlmack3-92kQj/view?usp=share_link,https://drive.google.com/file/d/1qRpPoIdnznWjxZJc28qCpQV89UK5od04/view?usp=share_link,,
86,1,1,4,Remote,FALSE,Harmonic and Transposition Constraints Arising from the Use of the Roland TR-808 Bass Drum,"The study investigates hip-hop music producer Scott Storch's approach to tonality, where the song's key is transposed to fit the Roland TR-808 bass drum instead of tuning the drums to the song’s key. This process, involving the adjustment of all tracks except the bass drum, suggests significant production motives. The primary constraint stems from the limited usable pitch range of the TR-808 bass drum if its characteristic sound is to be preserved. The research examines drum tuning practices, the role of the Roland TR-808 in music, and the sub-bass qualities of its bass drum. Analysis of TR-808 samples reveals their spectral characteristics and their integration into modern genres like trap and hip-hop. The study also considers the impact of loudspeaker frequency response and human ear sensitivity on bass drum perception. The findings suggest that Storch’s method prioritizes the spectral properties of the bass drum over traditional pitch values, enhancing bass response and overall sound quality. The need to maintain the unique sound of the TR-808 bass drum underscores the importance of spectral formants and register in contemporary music production.",Emmanuel Deruty,Emmanuel Deruty (Sony Computer Science Laboratories)*,"Deruty, Emmanuel*",Computational musicology,"Applications -> music composition, performance, and production; Computational musicology -> digital musicology; Knowledge-driven approaches to MIR -> computational music theory and musicology; Musical features and properties -> musical style and genre",,,,,No,https://drive.google.com/file/d/13eZzr4F6FtWq7Kb7YCHicXXkl4N3zA8R/view?usp=share_link,,https://drive.google.com/file/d/1-7SRb1F67xRtNMhbnUuc06tTkUX2YJ8N/view?usp=share_link,https://drive.google.com/file/d/1O2570jxaug06VoO0xsDhykKHpqJiMlV4/view?usp=share_link,https://drive.google.com/file/d/1qualw556L5tVvL-2lA3CeS-tWGvHDswT/view?usp=share_link,https://drive.google.com/file/d/182IJrfhDQeOjnudgqPFEV672n0sYgkEh/view?usp=share_link,,
90,2,4,19,San Francisco,FALSE,MelodyT5: A Unified Score-to-Score Transformer for Symbolic Music Processing,"In the domain of symbolic music research, the progress of developing scalable systems has been notably hindered by the scarcity of available training data and the demand for models tailored to specific tasks. To address these issues, we propose MelodyT5, a novel unified framework that leverages an encoder-decoder architecture tailored for symbolic music processing in ABC notation. This framework challenges the conventional task-specific approach, considering various symbolic music tasks as score-to-score transformations. Consequently, it integrates seven melody-centric tasks, from generation to harmonization and segmentation, within a single model. Pre-trained on MelodyHub, a newly curated collection featuring over 261K unique melodies encoded in ABC notation and encompassing more than one million task instances, MelodyT5 demonstrates superior performance in symbolic music processing via multi-task transfer learning. Our findings highlight the efficacy of multi-task transfer learning in symbolic music processing, particularly for data-scarce tasks, challenging the prevailing task-specific paradigms and offering a comprehensive dataset and framework for future explorations in this domain.",Maosong Sun,Shangda Wu (Central Conservatory of Music); Yashan Wang (Central Conservatory of Music); Xiaobing Li (Central Conservatory of Music); Feng Yu (Central Conservatory of Music); Maosong Sun (Tsinghua University)*,"Wu, Shangda; Wang, Yashan; Li, Xiaobing; Yu, Feng; Sun, Maosong*",MIR fundamentals and methodology -> symbolic music processing,"Evaluation, datasets, and reproducibility -> novel datasets and use cases; MIR tasks -> music generation; Musical features and properties -> harmony, chords and tonality; Musical features and properties -> melody and motives; Musical features and properties -> structure, segmentation, and form",,,,,No,https://drive.google.com/file/d/1I72iajjKOPsQMmee8CDFiNCSIkQdArvP/view?usp=share_link,,https://drive.google.com/file/d/1GaJwHFJhCRNmFLeZGYLMhi9EKvnr7JV6/view?usp=share_link,https://drive.google.com/file/d/1jZrxMhcXPZU7iMAQID3nf_BI246t2GNs/view?usp=share_link,https://drive.google.com/file/d/1KZHABImBHV5T-_TK4OEVb1glgv-Xpbs5/view?usp=share_link,https://drive.google.com/file/d/1aksTuwefarTg6uroZCse-gSPK7_vHCu1/view?usp=share_link,,
96,2,3,7,San Francisco,FALSE,SpecMaskGIT: Masked Generative Modelling of Audio Spectrogram for Efficient Audio Synthesis and Beyond,"Recent advances in generative models that iteratively synthesize audio clips sparked great success in text-to-audio synthesis (TTA), but at the cost of slow synthesis speed and heavy computation. Although there have been attempts to accelerate the iterative procedure, high-quality TTA systems remain inefficient due to the hundreds of iterations required in the inference phase and large amount of model parameters. To address these challenges, we propose SpecMaskGIT, a light-weight, efficient yet effective TTA model based on the masked generative modeling of spectrograms. First, SpecMaskGIT synthesizes a realistic 10 s audio clip in less than 16 iterations, an order of magnitude less than previous iterative TTA methods. As a discrete model, SpecMaskGIT outperforms larger VQ-Diffusion and auto-regressive models in a TTA benchmark, while being real-time with only 4 CPU cores or even 30× faster with a GPU. Next, built upon a latent space of Mel-spectrograms, SpecMaskGIT has a wider range of applications (e.g., zero-shot bandwidth extension) than similar methods built on latent wave domains. Moreover, we interpret SpecMaskGIT as a generative extension to previous discriminative audio masked Transformers, and shed light on its audio representation learning potential. We hope that our work will inspire the exploration of masked audio modeling toward further diverse scenarios.",Zhi Zhong,Marco Comunità (Queen Mary University of London); Zhi Zhong (Sony Group Corporation)*; Akira Takahashi (Sony Group Corporation); Shiqi Yang (Sony); Mengjie Zhao (Sony Group Corporation); Koichi Saito (Sony Gruop Corporation); Yukara Ikemiya (Sony Research); Takashi Shibuya (Sony AI); Shusuke Takahashi (Sony Group Corporation); Yuki Mitsufuji (Sony AI),"Comunita, Marco; Zhong, Zhi*; Takahashi, Akira; Yang, Shiqi; Zhao, Mengjie; Saito, Koichi; Ikemiya, Yukara; Shibuya, Takashi; Takahashi, Shusuke; Mitsufuji, Yuki",Generative Tasks -> music and audio synthesis,Generative Tasks -> interactions; Generative Tasks -> real-time considerations; Generative Tasks -> transformations; MIR tasks -> automatic classification; Musical features and properties -> representations of music,,,,,No,https://drive.google.com/file/d/1Vinmy5AVoQSPJOvA-qYFu32kPhx8_r8x/view?usp=sharing,,https://drive.google.com/file/d/1GvfnJaoT73dkCHy0CsV5WcrTSjfomUFe/view?usp=sharing,https://drive.google.com/file/d/1YZkyRX_07zw72sOvTA9eoaEjcDtPfVIm/view?usp=sharing,https://drive.google.com/file/d/1h34o3dFNby363faQnn4IYC8mFwPWu4fc/view?usp=sharing,https://docs.google.com/presentation/d/1gS6pbZypIAgkwD1-Je0v0T4Ecr3eSHGl/edit?usp=share_link&ouid=110993997319166704578&rtpof=true&sd=true,,
103,2,4,14,San Francisco,FALSE,TheGlueNote: Learned Representations for Robust and Flexible Note Alignment,"Note alignment refers to the task of matching individual notes of two versions of the same symbolically encoded piece. Methods addressing this task commonly rely on sequence alignment algorithms such as Hidden Markov Models or Dynamic Time Warping (DTW) applied directly to note or onset sequences. While successful in many cases, such methods struggle with large mismatches between the versions. In this work, we learn note-wise representations from data augmented with various complex mismatch cases, e.g. repeats, skips, block insertions, and long trills. At the heart of our approach lies a transformer encoder network --- TheGlueNote --- which predicts pairwise note similarities for two 512 note subsequences. We postprocess the predicted similarities using flavors of weightedDTW and pitch-separated onsetDTW to retrieve note matches for two sequences of arbitrary length. Our approach performs on par with the state of the art in terms of note alignment accuracy, is considerably more robust to version mismatches, and works directly on any pair of MIDI files.",Silvan Peter,Silvan David Peter (JKU)*; Gerhard Widmer (Johannes Kepler University),"Peter, Silvan*; Widmer, Gerhard","MIR tasks -> alignment, synchronization, and score following",MIR fundamentals and methodology -> symbolic music processing,,,,,No,https://drive.google.com/file/d/1GHRxv4pvcpny1pO3Lgx1W1u7kbGoUXnn/view?usp=sharing,,https://drive.google.com/file/d/12FVcGsJpZaS3qKKGy82vNAFXsaaoTm_9/view?usp=sharing,https://drive.google.com/file/d/1PfmicdgUqlBQIlc7QFRllz3Km0qc3w_D/view?usp=sharing,https://drive.google.com/file/d/1CcnPsI0Fq-S-7zkqwYY6WIRd5K3wrNAn/view?usp=share_link,https://drive.google.com/file/d/1aAlxzvZpTkBq7dEnpPFDXIyUMlq-LFNm/view?usp=share_link,,
113,2,3,1,Remote,TRUE,Green MIR? Investigating computational cost of recent music-Ai research in ISMIR,"The environmental footprint of Generative AI and other Deep Learning (DL) technologies is increasing. To understand the scale of the problem and to identify solutions for avoiding excessive energy use in DL research at communities such as ISMIR, more knowledge is needed of the current energy cost of the undertaken research. In this paper, we provide a scoping inquiry of how the ISMIR research concerning automatic music generation (AMG) and computing-heavy music analysis currently discloses information related to environmental impact. We present a study based on two corpora that document 1) ISMIR papers published in the years 2017–2023 that introduce an AMG model, and 2) ISMIR papers from the years 2022–2023 that propose music analysis models and include heavy computations with GPUs. Our study demonstrates a lack of transparency in model training documentation. It provides the first estimates of energy consumption related to model training at ISMIR, as a baseline for making more systematic estimates about the energy footprint of the ISMIR conference in relation to other machine learning events. Furthermore, we map the geographical distribution of generative model contributions and discuss the corporate role in the funding and model choices in this body of work.",Andre Holzapfel,"Andre Holzapfel (KTH Royal Institute of Technology in Stockholm)*; Anna-Kaisa Kaila (KTH Royal Institute of Technology, Stockholm); Petra Jääskeläinen (KTH)","Holzapfel, Andre*; Kaila, Anna-Kaisa; Jääskeläinen, Petra",Philosophical and ethical discussions -> ethical issues related to designing and implementing MIR tools and technologies,"Evaluation, datasets, and reproducibility -> reproducibility; Knowledge-driven approaches to MIR -> machine learning/artificial intelligence for music; Philosophical and ethical discussions -> legal and societal aspects of MIR",,,,,Yes,https://drive.google.com/file/d/1rAepoJk1U2R4g3S_AcxdqWDGzRGd7xPg/view?usp=sharing,,https://drive.google.com/file/d/1FIrhz2X1ejLKxNdDNhi3msM28OhC1MA3/view?usp=share_link,https://drive.google.com/file/d/1cYKFcKBYn5ndyPg95kzhNTzvaUouhemE/view?usp=share_link,https://drive.google.com/file/d/1tPtxxZyBA0nvUGkMXkTlkGIyxkIwzxft/view?usp=share_link,https://drive.google.com/file/d/1O0QwwL0Wl4M2Qq_7MqW3DtwODgviHBsh/view?usp=share_link,,
114,2,4,7,San Francisco,FALSE,PiCoGen2: Piano cover generation with transfer learning approach and weakly aligned data,"Piano cover generation aims to create a piano cover from a pop song. Existing approaches mainly employ supervised learning and the training demands strongly-aligned and paired song-to-piano data, which is built by remapping piano notes to song audio. This would, however, result in the loss of piano information and accordingly cause inconsistencies between the original and remapped piano versions. To overcome this limitation, we propose a transfer learning approach that pre-trains our model on piano-only data and fine-tunes it on weakly-aligned paired data constructed without note remapping. During pre-training, to guide the model to learn piano composition concepts instead of merely transcribing audio, we use an existing lead sheet transcription model as the encoder to extract high-level features from the piano recordings. The pre-trained model is then fine-tuned on the paired song-piano data to transfer the learned composition knowledge to the pop song domain. Our evaluation shows that this training strategy enables our model, named PiCoGen2, to attain high-quality results, outperforming baselines on both objective and subjective metrics across five pop genres.",Chih-Pin Tan,Chih-Pin Tan (National Taiwan University)*; Hsin Ai (National Taiwan University); Yi-Hsin Chang (National Taiwan University); Shuen-Huei Guan (KKCompany Techonologies); Yi-Hsuan Yang (National Taiwan University),"Tan, Chih-Pin*; Ai, Hsin; Chang, Yi-Hsin; Guan, Shuen-Huei; Yang, Yi-Hsuan",Generative Tasks,"Applications -> music composition, performance, and production; Generative Tasks -> transformations; Knowledge-driven approaches to MIR -> machine learning/artificial intelligence for music; MIR tasks -> music generation; Musical features and properties -> musical style and genre",,,,,No,https://drive.google.com/file/d/1ZtVeAwZ4H40Ed2JSPt2uKGBJNjhMvXcP/view?usp=drive_link,,https://drive.google.com/file/d/1GN7GywKGpF4j-DxhbAJey0_uLccSOJre/view?usp=drive_link,https://drive.google.com/file/d/1YM75UhJ5geuLqXYH111Zk8vm9diDLPtd/view?usp=drive_link,https://drive.google.com/file/d/1c8Y5WtQiVYHB4GSufL3261GJ2Y00-rWZ/view?usp=drive_link,https://drive.google.com/file/d/1h-Nky-9BXM0U2jBzVyvuYQClaoQ_QGgS/view?usp=drive_link,,
131,3,5,7,San Francisco,FALSE,Between the AI and Me: Analysing Listeners' Perspectives on AI- and Human-Composed Progressive Metal Music,"Generative AI models have recently blossomed, significantly impacting artistic and musical traditions. Research investigating how humans interact with and deem these models is therefore crucial. Through a listening and reflection study, we explore participants' perspectives on AI- vs human-generated progressive metal, in symbolic format, using rock music as a control group. AI-generated examples were produced by ProgGP [1], a Transformer-based model. We propose a mixed methods approach to assess the effects of generation type (human vs. AI), genre (progressive metal vs. rock), and curation process (random vs. cherry-picked). This combines quantitative feedback on genre congruence, preference, creativity, consistency, playability, humanness, and repeatability, and qualitative feedback to provide insights into listeners' experiences. A total of 32 progressive metal fans completed the study. Our findings validate the use of fine-tuning to achieve genre-specific specialization in AI music generation, as listeners could distinguish between AI-generated rock and progressive metal. Despite some AI-generated excerpts receiving similar ratings to human music, listeners exhibited a preference for human compositions. Thematic analysis identified key features for genre and AI vs. human distinctions. Finally, we consider the ethical implications of our work in promoting musical data diversity within MIR research by focusing on an under-explored genre.cusing on an under-explored genre.",Jackson J Loth,Pedro Pereira Sarmento (Centre for Digital Music); Jackson J Loth (Queen Mary University of London)*; Mathieu Barthet (Queen Mary University of London),"Sarmento, Pedro Pereira; Loth, Jackson J*; Barthet, Mathieu",Generative Tasks -> qualitative evaluations,Creativity -> human-ai co-creativity; Creativity -> humanistic discussions; Musical features and properties -> musical style and genre; Philosophical and ethical discussions -> ethical issues related to designing and implementing MIR tools and technologies; Philosophical and ethical discussions -> philosophical and methodological foundations,,,,,No,https://drive.google.com/file/d/1YtkoSFwjRZRWBoBSyzxItdPMH0HS2-gj/view?usp=drive_link,,https://drive.google.com/file/d/1Gz6u9QdoBF6iREW6k4742hjVStT5sNMH/view?usp=drive_link,https://drive.google.com/file/d/1xI02FsNtZTNZsYLy4xH-1-lK30ok51vy/view?usp=drive_link,https://drive.google.com/file/d/1p4iM4QJ49Hr4TaPrP9qkgUISHLKvhf39/view?usp=drive_link,https://docs.google.com/presentation/d/1R615zKAqpEqsHGLxLFbhUVRzEj5s5GJk/edit?usp=drive_link&ouid=114061375603120990288&rtpof=true&sd=true,,
142,2,4,20,San Francisco,FALSE,GraphMuse: A Library for Symbolic Music Graph Processing,"Graph Neural Networks (GNNs) have recently gained traction in symbolic music tasks, yet a lack of a unified framework impedes progress. Addressing this gap, we present GraphMuse, a graph processing framework and library that facilitates efficient music graph processing and GNN training for symbolic music tasks. Central to our contribution is a new neighbor sampling technique specifically targeted toward meaningful behavior in musical scores. Additionally, GraphMuse integrates hierarchical modeling elements that augment the expressivity and capabilities of graph networks for musical tasks. Experiments with two specific musical prediction tasks -- pitch spelling and cadence detection -- demonstrate significant performance improvement over previous methods. Our hope is that GraphMuse will lead to a boost in, and standardization of, symbolic music processing based on graph representations. The library is available at https://github.com/manoskary/graphmuse",Emmanouil Karystinaios,Emmanouil Karystinaios (Johannes Kepler University)*; Gerhard Widmer (Johannes Kepler University),"Karystinaios, Emmanouil*; Widmer, Gerhard",MIR fundamentals and methodology -> symbolic music processing,Applications -> digital libraries and archives; Knowledge-driven approaches to MIR -> representations of music,,,,,No,https://drive.google.com/file/d/1v3xnltIXVjl686mPvV34AsC3eN_vNlXr/view?usp=drive_link,,https://drive.google.com/file/d/1hsWV5uz5Y3sBhXcOUIYbhFU5CzFdMBdl/view?usp=drive_link,https://drive.google.com/file/d/1OBlsXp-7Cbh0dH5M1H7HEpVbFp0bsDAt/view?usp=drive_link,https://drive.google.com/file/d/1yKYiFaUKBy94b4hVCUKY5VxPMavNYv5w/view?usp=drive_link,https://docs.google.com/presentation/d/1e8Hqm6q6ksb0mU3ZSkPXUblJP9gXXwOE/edit?usp=drive_link&ouid=114061375603120990288&rtpof=true&sd=true,,
