UID,day,session,position,paper_presentation,long_presentation,title,Abstract,primary_author,authors_and_affil,authors,primary_subject,secondary_subject,SpecialTrack,abstract_short,StudentAuthor,StudentAuthor.1,AwardNominee,pdf_path,video,poster_pdf,thumbnail,slides_pdf,channel_url,slack_channel
189,3,5,3,San Francisco,FALSE,Do Music Generation Models Encode Music Theory?,"Music foundation models possess impressive music generation capabilities. When people compose music, they may infuse their understanding of music into their work, by using notes and intervals to craft melodies, chords to build progressions, and tempo to create a rhythmic feel. To what extent is this true of music generation models? More specifically, are fundamental Western music theory concepts observable within the ""inner workings"" of these models? Recent work proposed leveraging latent audio representations from music generation models towards music information retrieval tasks (e.g. genre classification, emotion recognition), which suggests that high-level musical characteristics are encoded within these models. However, probing individual music theory concepts (e.g. tempo, pitch class, chord quality) remains under-explored. Thus, we introduce SynTheory, a synthetic MIDI and audio music theory dataset, consisting of tempos, time signatures, notes, intervals, scales, chords, and chord progressions concepts. We then propose a framework to probe for these music theory concepts in music foundation models (Jukebox and MusicGen) and assess how strongly they encode these concepts within their internal representations. Our findings suggest that music theory concepts are discernible within foundation models and that the degree to which they are detectable varies by model size and layer.",Megan Wei,Megan Wei (Brown University)*; Michael Freeman (Brown University); Chris Donahue (Carnegie Mellon University); Chen Sun (Brown University),"Wei, Megan*; Freeman, Michael; Donahue, Chris; Sun, Chen",Musical features and properties,"Knowledge-driven approaches to MIR -> computational music theory and musicology; Musical features and properties -> representations of music; Musical features and properties -> rhythm, beat, tempo",,,,,No,https://drive.google.com/file/d/1R2hwTNW-EQT5xNODQKtDdxot3yFrTpAE/view?usp=sharing,https://drive.google.com/file/d/1kB-DGyxmkJIC_aZ1oqnbhqQBlyjlZPGm/view?usp=drive_link,https://drive.google.com/file/d/1MATeD7zabPqC5O0vgoKabKJZjuKhOpHH/view?usp=drive_link,https://drive.google.com/file/d/16sNrWnQaBXKcd2X3bjhM0XRUHzA0FA8w/view?usp=sharing,https://drive.google.com/file/d/1_rsqoSkGyWDpp3sb8knCUVqJWXLk9C-0/view?usp=drive_link,https://ismir2024.slack.com/archives/C07U9F62P9V,p5-03-do-music-generation
193,3,6,15,San Francisco,FALSE,Toward a More Complete OMR Solution,"Optical music recognition (OMR) aims to convert music notation into digital formats. One approach to tackle OMR is through a multi-stage pipeline, where the model first detects visual music notation elements in the image (object detection) and then assembles them into a music notation (notation assembly). In this paper, we focus on the MUSCIMA++ v2.0 dataset. It represents musical notation as a graph, where the pairwise relationships among detected music objects are predicted. Most previous work on notation assembly unrealistically assumes perfect object detection. In this study, we consider both stages together. First, we introduce a music object detector based on YOLOv8, which improves detection performance. Second, we introduce a supervised training pipeline that completes the notation assembly stage based on detection output. We find that this model is able to outperform existing models trained on perfect detection output, showing the benefit of considering the detection and assembly stage in a more holistic way. These findings are an important step toward a more complete OMR solution.",Guang Yang,Guang Yang (University of Washington)*; Muru Zhang (University of Washington); Lin Qiu (University of Washington); Yanming Wan (University of Washington); Noah A Smith (University of Washington and Allen Institute for AI),"Yang, Guang*; Zhang, Muru; Qiu, Lin; Wan, Yanming; Smith, Noah A",MIR tasks -> optical music recognition,"Evaluation, datasets, and reproducibility -> evaluation metrics; Knowledge-driven approaches to MIR -> machine learning/artificial intelligence for music",,,,,No,https://drive.google.com/file/d/1ymF8sx8o5Krxh8EGMA2UwmhRX0ov0YkR/view?usp=sharing,https://drive.google.com/file/d/161aBb4xSrTI7akF0_bTI2SPwTzI4zunK/view?usp=drive_link,https://drive.google.com/file/d/1S0-dUNVs10dALNj86ORBmU5EaH9IV-79/view?usp=drive_link,https://drive.google.com/file/d/1py7A8U7NlmRV53-cKnyykr626eHooiwL/view?usp=drive_link,https://drive.google.com/file/d/1Vzp703cjlBywTrZz_PSw3wayOGtqz01Y/view?usp=drive_link,https://ismir2024.slack.com/archives/C07UM5ZULS1,p6-15-toward-a-more
198,3,6,5,San Francisco,FALSE,MidiCaps: A Large-scale MIDI Dataset with Text Captions,"Generative models guided by text prompts are increasingly becoming more popular. However, no text-to-MIDI models currently exist due to the lack of a captioned MIDI dataset. This work aims to enable research that combines LLMs with symbolic music by presenting MidiCaps, the first openly available large-scale MIDI dataset with text captions. MIDI (Musical Instrument Digital Interface) files are widely used for encoding musical information and can capture the nuances of musical composition. They are widely used by music producers, composers, musicologists, and performers alike. Inspired by recent advancements in captioning techniques, we present a curated dataset of over 168k MIDI files with textual descriptions. Each MIDI caption describes the musical content, including tempo, chord progression, time signature, instruments, genre, and mood, thus facilitating multi-modal exploration and analysis. The dataset encompasses various genres, styles, and complexities, offering a rich data source for training and evaluating models for tasks such as music information retrieval, music understanding, and cross-modal translation. We provide detailed statistics about the dataset and have assessed the quality of the captions in an extensive listening study. We anticipate that this resource will stimulate further research at the intersection of music and natural language processing, fostering advancements in both fields.",Abhinaba Roy,Jan Melechovsky (Singapore University of Technology and Design); Abhinaba Roy (SUTD)*; Dorien Herremans (Singapore University of Technology and Design),"Melechovsky, Jan; Roy, Abhinaba*; Herremans, Dorien","Evaluation, datasets, and reproducibility -> novel datasets and use cases","Generative Tasks -> music and audio synthesis; MIR fundamentals and methodology -> lyrics and other textual data; MIR fundamentals and methodology -> symbolic music processing; MIR fundamentals and methodology -> web mining, and natural language processing; Musical features and properties -> representations of music",,,,,No,https://drive.google.com/file/d/18ltPsN6Gp-anmdtvXVkfsuFWG-tTAvmF/view?usp=sharing,https://drive.google.com/file/d/1qIrcmvqJRIO-Ov3kpzGRrxay8Mh_jzom/view?usp=drive_link,https://drive.google.com/file/d/16b061WIusDZCvVrtgezh5AiyCE9ElkdT/view?usp=drive_link,https://drive.google.com/file/d/1oM1Zo-J2dI_yHQeh3Op6J7Bc3eC4oS6W/view?usp=drive_link,https://docs.google.com/presentation/d/1U8-zNyvoh2XQzxW63IP0gEs5Agsz9mcR/edit?usp=drive_link&ouid=100778348236936722074&rtpof=true&sd=true,https://ismir2024.slack.com/archives/C07UPUEUDV1,p6-05-midicaps-a-large
205,4,7,15,San Francisco,FALSE,Using Item Response Theory to Aggregate Music Annotation Results of Multiple Annotators,"Human music annotation is one of the most important tasks in music information retrieval (MIR) research. Results of labeling, tagging, assessment, and evaluation can be used as training data for machine learning models that estimate them automatically. For such machine learning purposes, a single target (e.g., song) is usually annotated by multiple human annotators, and the results are aggregated by majority voting or averaging. Majority voting, however, requires the number of annotators to be an odd number, which is not always possible. And averaging is sensitive to differences in the judgmental characteristics of each annotator and cannot be used for ordinal scales. This paper therefore proposes that the item response theory (IRT) be used to aggregate the music annotation results of multiple annotators. IRT-based models can jointly estimate annotators' characteristics and latent scores (i.e., aggregations of annotation results) of the targets, and they are also applicable to ordinal scales. We evaluated the IRT-based models in two actual cases of music annotation --- semantic tagging of music and Likert scale-based evaluation of singing skill --- and compared those models with their simplified models that do not consider the characteristics of each annotator.",Tomoyasu Nakano,Tomoyasu Nakano (National Institute of Advanced Industrial Science and Technology (AIST))*; Masataka Goto (National Institute of Advanced Industrial Science and Technology (AIST)),"Nakano, Tomoyasu*; Goto, Masataka",MIR tasks -> music transcription and annotation,,,,,,No,https://drive.google.com/file/d/1BVN3Qgw_tfZC3iUYrjK2mBdM4exBcZhl/view?usp=sharing,https://drive.google.com/file/d/17c0w9DoxLbJZUjA6tUriZUgnE54eOgqb/view?usp=drive_link,https://drive.google.com/file/d/1s7Hc5Jmx_LyU5wfSknSFiNyXYGg6xxgT/view?usp=drive_link,https://drive.google.com/file/d/14BG6zTeWW-X8EG95y9GnlrTbIKM-esJo/view?usp=drive_link,https://drive.google.com/file/d/1Gtsgw0oUsPWNgawHzNeDSgBmsJLasdnk/view?usp=drive_link,https://ismir2024.slack.com/archives/C07UHCURWMC,p7-15-using-item-response
207,1,1,1,Remote,TRUE,Formal Modeling of Structural Repetition using Tree Compression,"Repetition is central to musical structure as it gives rise both to piece-wise and stylistic coherence. Identifying repetitions in music is computationally not trivial, especially when they are varied or deeply hidden within tree-like structures. Rather than focusing on repetitions of musical events, we propose to pursue repeated structural relations between events. More specifically, given a context-free grammar that describes a tonal structure, we aim to computationally identify such relational repetitions within the derivation tree of the grammar. To this end, we first introduce the template, a grammar-generic structure for generating trees that contain structural repetitions. We then approach the discovery of structural repetitions as a search for optimally compressible templates that describe a corpus of pieces in the form of production-rule-labeled trees. To make it tractable, we develop a heuristic, inspired by tree compression algorithms, to approximate the optimally compressible templates of the corpus. After implementing the algorithm in Haskell, we apply it to a corpus of jazz harmony trees, where we assess its performance based on the compressibility of the resulting templates and the music-theoretical relevance of the identified repetitions.",Zeng Ren,Zeng Ren (École Polytechnique Fédérale de Lausanne)*; Yannis Rammos (EPFL); Martin A Rohrmeier (Ecole Polytechnique Fédérale de Lausanne),"Ren, Zeng*; Rammos, Yannis; Rohrmeier, Martin A",Computational musicology,"Computational musicology -> mathematical music theory; Knowledge-driven approaches to MIR -> computational music theory and musicology; Knowledge-driven approaches to MIR -> representations of music; Musical features and properties -> harmony, chords and tonality; Musical features and properties -> structure, segmentation, and form",,,,,Yes,https://drive.google.com/file/d/1mL_I29Y9OXfstFXm0C2EVB8xozviBLhL/view?usp=sharing,https://drive.google.com/file/d/1bXs3DMiL--96DfbHYoJfdmp4cQe4bIEr/view?usp=drive_link,https://drive.google.com/file/d/1g-xHPS7iaP2x5Gbq3DlGXcaiNs5NAXRC/view?usp=drive_link,https://drive.google.com/file/d/14P2-03D3SKJsWef0kto2uDsHpqCh4-3h/view?usp=drive_link,https://drive.google.com/file/d/1HiVtUezFuXJ3e7h_9MsAc18nYJwVFyeH/view?usp=drive_link,https://ismir2024.slack.com/archives/C07UPUF5AKD,p1-01-formal-modeling-of
212,2,3,16,Remote,FALSE,WHO'S AFRAID OF THE `ARTYFYSHALL BYRD'? HISTORICAL NOTIONS AND CURRENT CHALLENGES OF MUSICAL ARTIFICIALITY,"The meteoric surge of AI-generated music has prompted significant concerns among artists and publishers alike. Some fear that the adoption of AI is poised to result in massive job destruction; others sense it will jeopardize and eventually upend all legal frameworks of intellectual property. AI, however, is not the first instance where humanity has confronted the prospect of machines emulating musical creativity. Already in the Baroque, various modes of musical artificiality were explored, ranging from automata and organ stops mimicking human performance and natural sounds, up to devices for mechanized composition (e.g., Athanasius Kircher, Johann Philip Kirnberger, C.P.E. Bach, Antonio Calegari and Diederich Nickolaus Winkel).   Valuable insights emerge from the reconsideration—and digital implementation—of these curiosities through the lens of present-day generative models. It can be argued that the very notion of ‘artificiality’ has presented humanity with long-standing philosophical dilemmas, in addressing the debate on the role of art as a substitute of (divine) nature. By digitally implementing and formalizing some pioneering instances of  algorithmically-generated music we wish to illustrate how mechanical devices have played a role in human art and entertainment prior to our digital era.",Nicholas Cornia,Nicholas Cornia (Orpheus Instituut)*; Bruno Forment (Orpheus Instituut),"Cornia, Nicholas*; Forment, Bruno",Philosophical and ethical discussions -> philosophical and methodological foundations,Creativity -> computational creativity; Creativity -> humanistic discussions; MIR tasks -> optical music recognition; Philosophical and ethical discussions -> ethical issues related to designing and implementing MIR tools and technologies; Philosophical and ethical discussions -> legal and societal aspects of MIR,,,,,No,https://drive.google.com/file/d/1Wd35AEbNSSAsSknVhi-6OXNFaTHJdnKa/view?usp=sharing,https://drive.google.com/file/d/1oN4xp6Z0jJeApFTE6fruD1CBM_2IjaBQ/view?usp=drive_link,https://drive.google.com/file/d/1tShkawH3_Fc0_5EAGZp7ZfCG9nfmnRfO/view?usp=drive_link,https://drive.google.com/file/d/1OSpNzx0I9AaqIsnNCK-qLTBMmtpAhHGQ/view?usp=drive_link,https://drive.google.com/file/d/1k9Vy-A43gkcP4cm_nvITibfQC_Pz1nMS/view?usp=drive_link,https://ismir2024.slack.com/archives/C07UHELJVTQ,p3-16-who-s-afraid
214,1,1,16,San Francisco,FALSE,Semi-Supervised Piano Transcription Using Pseudo-Labeling Techniques,"Automatic piano transcription (APT) transforms piano recordings into symbolic note events. In recent years, APT has relied on supervised deep learning, which demands a large amount of labeled data that is often limited. This paper introduces a semi-supervised approach to APT, leveraging unlabeled data with techniques originally introduced in computer vision (CV): pseudo-labeling, consistency regularization, and distribution matching. The idea of pseudo-labeling is to use the current model for producing artificial labels for unlabeled data, and consistency regularization makes the model's predictions for unlabeled data robust to augmentations. Finally, distribution matching ensures that the pseudo-labels follow the same marginal distribution as the reference labels, adding an extra layer of robustness. Our method, tested on three piano datasets, shows improvements over purely supervised methods and performs comparably to existing semi-supervised approaches. Conceptually, this work illustrates that semi-supervised learning techniques from CV can be effectively transferred to the music domain, considerably reducing the dependence on large annotated datasets.",Sebastian Strahl,Sebastian Strahl (International Audio Laboratories Erlangen)*; Meinard Müller (International Audio Laboratories Erlangen),"Strahl, Sebastian*; Müller, Meinard",MIR tasks -> music transcription and annotation,Knowledge-driven approaches to MIR -> machine learning/artificial intelligence for music; Knowledge-driven approaches to MIR -> representations of music,,,,,No,https://drive.google.com/file/d/1CHhf2YqFLE4yhviOEnoiWPkquE-MqLBy/view?usp=sharing,https://drive.google.com/file/d/1wLdS2VgE1tyDmEQWvyI0OaVOt-ZAJvL3/view?usp=drive_link,https://drive.google.com/file/d/1qYZX0b77rH_vb-cNHkkztkV7ggpFtA3e/view?usp=drive_link,https://drive.google.com/file/d/1hvjjP5pOg0rHA1HL7ua4uD2K767PJ1_m/view?usp=drive_link,https://drive.google.com/file/d/1DhAU3B4pLBPavXvgRt-b770pUt6p_g49/view?usp=drive_link,https://ismir2024.slack.com/archives/C07UQ1LBAUA,p1-16-semi-supervised-piano
216,4,7,5,San Francisco,FALSE,Towards Assessing Data Replication in Music Generation with Music Similarity Metrics on Raw Audio,"Recent advancements in music generation are raising multiple concerns about the implications of AI in creative music processes, current business models and impacts related to intellectual property management. A relevant discussion and related technical challenge is the potential replication and plagiarism of the training set in AI-generated music, which could lead to misuse of data and intellectual property rights violations. To tackle this issue, we present the Music Replication Assessment (MiRA) tool: a model-independent open evaluation method based on diverse audio music similarity metrics to assess data replication. We evaluate the ability of five metrics to identify exact replication by conducting a controlled replication experiment in different music genres using synthetic samples. Our results show that the proposed methodology can estimate exact data replication with a proportion higher than 10%. By introducing the MiRA tool, we intend to encourage the open evaluation of music-generative models by researchers, developers, and users concerning data replication, highlighting the importance of the ethical, social, legal, and economic consequences. Code and examples are available for reproducibility purposes.",Roser Batlle-Roca,"Roser Batlle-Roca (Universitat Pompeu Fabra)*; Wei-Hsiang Liao (Sony Group Corporation); Xavier Serra (Universitat Pompeu Fabra ); Yuki Mitsufuji (Sony AI); Emilia Gomez (Joint Research Centre, European Commission & Universitat Pompeu Fabra)","Batlle-Roca, Roser*; Liao, Wei-Hsiang; Serra, Xavier; Mitsufuji, Yuki; Gomez, Emilia","Evaluation, datasets, and reproducibility -> evaluation methodology","Evaluation, datasets, and reproducibility -> evaluation metrics; Generative Tasks -> evaluation metrics; MIR tasks -> music generation; MIR tasks -> similarity metrics",,,,,No,https://drive.google.com/file/d/1VxJq1lT9F1gJ64Cvb10en0WeVNUeV0hk/view?usp=sharing,https://drive.google.com/file/d/1TWr7oLMJb2Q7ENmhfPF6rpZeDhwSDqMI/view?usp=sharing,https://drive.google.com/file/d/1WbKAV-UY56QfYuDJhsB4Vzm6A7oUvrp9/view?usp=sharing,https://drive.google.com/file/d/1yVUzCS6SITQJSFhIqk1PjpCsML0cAtko/view?usp=sharing,https://drive.google.com/file/d/1vYgaCU99Gc2jiaA8CW2XRgc09pnag9EI/view?usp=sharing,https://ismir2024.slack.com/archives/C07UHCV5PLN,p7-05-towards-assessing-data
218,3,5,4,San Francisco,FALSE,PolySinger: Singing-Voice to Singing-Voice Translation from English to Japanese,"The speech domain prevails in the spotlight for several natural language processing (NLP) tasks while the singing domain remains less explored. The culmination of NLP is the speech-to-speech translation (S2ST) task, referring to translation and synthesis of human speech. A disparity between S2ST and the possible adaptation to the singing domain, which we describe as singing-voice to singing-voice translation (SV2SVT), is becoming prominent as the former is progressing ever faster, while the latter is at a standstill. Singing-voice synthesis systems are overcoming the barrier of multi-lingual synthesis, despite limited attention has been paid to multi-lingual songwriting and song translation. This paper endeavors to determine what is required for successful SV2SVT and proposes PolySinger (Polyglot Singer): the first system for SV2SVT, performing lyrics translation from English to Japanese. A cascaded approach is proposed to establish a framework with a high degree of control which can potentially diminish the disparity between SV2SVT and S2ST. The performance of PolySinger is evaluated by a mean opinion score test with native Japanese speakers. Results and in-depth discussions with test subjects suggest a solid foundation for SV2SVT, but several shortcomings must be overcome, which are discussed for the future of SV2SVT.",Silas Antonisen,Silas Antonisen (University of Granada)*; Iván López-Espejo (University of Granada),"Antonisen, Silas*; López-Espejo, Iván",Creativity -> tools for artists,"Applications -> music composition, performance, and production; Human-centered MIR -> human-computer interaction; Knowledge-driven approaches to MIR -> machine learning/artificial intelligence for music",,,,,No,https://drive.google.com/file/d/1FHMaLM9kP_efWjgEbKSpw992jVUIfaF6/view?usp=sharing,https://drive.google.com/file/d/19Zc4xVJS-BOs4ZNWClZ5Pd2Z-lCAyiPt/view?usp=sharing,https://drive.google.com/file/d/1zaKJIe_X3jNlitv-0i71A42s2-yyIcN4/view?usp=sharing,https://drive.google.com/file/d/1z7L7IDjLpgsOxxR6AsxUalDx43dLPUDY/view?usp=sharing,https://drive.google.com/file/d/1qb0fegUsc-EIrDKStBAIXaM7VxfTAHge/view?usp=sharing,https://ismir2024.slack.com/archives/C07USGM7B8C,p5-04-polysinger-singing-voice
225,1,2,8,San Francisco,FALSE,DIFF-A-RIFF: MUSICAL ACCOMPANIMENT CO-CREATION VIA LATENT DIFFUSION MODELS,"Recent advancements in deep generative models present new opportunities for music production but also pose challenges, such as high computational demands and limited audio quality. Moreover, current systems frequently rely solely on text input and typically focus on producing complete musical pieces, which is incompatible with existing workflows in music production. To address these issues, we introduce Diff-A-Riff, a Latent Diffusion Model designed to generate high-quality instrumental accompaniments adaptable to any musical context. This model offers control through either audio references, text prompts, or both, and produces 48kHz pseudo-stereo audio while significantly reducing inference time and memory usage. We demonstrate the model's capabilities through objective metrics and subjective listening tests, with extensive examples available on the accompanying website.",Javier Nistal,"Javier Nistal (Sony CSL)*; Marco Pasini (Queen Mary University of London); Cyran Aouameur  (Sony CSL); Stefan Lattner (Sony Computer Science Laboratories, Paris); Maarten Grachten (Machine Learning Consultant)","Nistal, Javier*; Pasini, Marco; Aouameur , Cyran; Lattner, Stefan; Grachten, Maarten",Generative Tasks -> music and audio synthesis,"Applications -> music composition, performance, and production; Creativity -> human-ai co-creativity; Creativity -> tools for artists; Human-centered MIR -> human-computer interaction; MIR tasks -> music generation",,,,,No,https://drive.google.com/file/d/17kD9fcVGogcbAwqArNmF6T8HuJF_OU_5/view?usp=sharing,https://drive.google.com/file/d/1dNMZ76lzlZFS_feWfNRjIv5Vkfx55749/view?usp=sharing,https://drive.google.com/file/d/1QBTWFHw78yg2xAQcWLAIyXrpiDC2L7Rg/view?usp=sharing,https://drive.google.com/file/d/1uMTTqCZzqQnVJHHJGHm0EEFkEUzd60hu/view?usp=sharing,https://drive.google.com/file/d/1mNei697xb4cLMF__7BVSgOl_RRIwWb34/view?usp=sharing,https://ismir2024.slack.com/archives/C07V2MUP4JV,p2-08-diff-a-riff
