UID,day,session,position,paper_presentation,long_presentation,title,Abstract,primary_author,authors_and_affil,authors,primary_subject,secondary_subject,SpecialTrack,abstract_short,StudentAuthor,StudentAuthor.1,AwardNominee,pdf_path,video,poster_pdf,thumbnail,slides_pdf,channel_url,slack_channel
84,2,4,9,San Francisco,FALSE,Semi-Supervised Contrastive Learning of Musical Representations,"Despite the success of contrastive learning in Music Information Retrieval, the inherent ambiguity of contrastive self-supervision presents a challenge. Relying solely on augmentation chains and self-supervised positive sampling strategies may lead to a pretraining objective that does not capture key musical information for downstream tasks. We introduce semi-supervised contrastive learning (SemiSupCon), an architecturally simple method for leveraging musically informed supervision signals in the contrastive learning of musical representations. Our approach introduces musically-relevant supervision signals into self-supervised contrastive learning by combining supervised and self-supervised contrastive objectives in a simple framework compared to previous work. This framework improves downstream performance and robustness to audio corruptions on a range of downstream MIR tasks with moderate amounts of labeled data. Our approach enables shaping the learned similarity metric through the choice of labeled data which (1) infuses the representations with musical domain knowledge and (2) improves out-of-domain performance with minimal general downstream performance loss. We show strong transfer learning performance on musically related yet not trivially similar tasks - such as pitch and key estimation. Additionally, our approach shows performance improvement on automatic tagging over self-supervised approaches with only 5% of available labels included in pretraining.",Julien PM Guinot,Julien Guinot (Queen Mary University of London)*; Elio Quinton (Universal Music Group); György Fazekas (QMUL),"Guinot, Julien PM*; Quinton, Elio; Fazekas, George",Knowledge-driven approaches to MIR,Knowledge-driven approaches to MIR -> machine learning/artificial intelligence for music; Knowledge-driven approaches to MIR -> representations of music; MIR fundamentals and methodology -> music signal processing; MIR tasks -> automatic classification; MIR tasks -> similarity metrics,,,,,No,https://drive.google.com/file/d/1ECakxR9sVf_ZHnob-6l6JbKdrWVgi38g/view?usp=sharing,https://drive.google.com/file/d/19iL-BCJj3nzFS7B-iUXkv0H0J5Fp6N-M/view?usp=sharing,https://drive.google.com/file/d/1X1wQwqw57B8YJmkW-9TNJlcAkbnwneti/view?usp=share_link,https://drive.google.com/file/d/1SEF_iws0abIu6oXPeRGG0DcJNLTtro00/view?usp=share_link,https://drive.google.com/file/d/1bujpntJiewF_aSBUUZLEYt_Qs4Kf43jh/view?usp=share_link,https://ismir2024.slack.com/archives/C07UPU8MTB5,p4-09-semi-supervised-contrastive
86,1,1,4,Remote,FALSE,Harmonic and Transposition Constraints Arising from the Use of the Roland TR-808 Bass Drum,"The study investigates hip-hop music producer Scott Storch's approach to tonality, where the song's key is transposed to fit the Roland TR-808 bass drum instead of tuning the drums to the song’s key. This process, involving the adjustment of all tracks except the bass drum, suggests significant production motives. The primary constraint stems from the limited usable pitch range of the TR-808 bass drum if its characteristic sound is to be preserved. The research examines drum tuning practices, the role of the Roland TR-808 in music, and the sub-bass qualities of its bass drum. Analysis of TR-808 samples reveals their spectral characteristics and their integration into modern genres like trap and hip-hop. The study also considers the impact of loudspeaker frequency response and human ear sensitivity on bass drum perception. The findings suggest that Storch’s method prioritizes the spectral properties of the bass drum over traditional pitch values, enhancing bass response and overall sound quality. The need to maintain the unique sound of the TR-808 bass drum underscores the importance of spectral formants and register in contemporary music production.",Emmanuel Deruty,Emmanuel Deruty (Sony Computer Science Laboratories)*,"Deruty, Emmanuel*",Computational musicology,"Applications -> music composition, performance, and production; Computational musicology -> digital musicology; Knowledge-driven approaches to MIR -> computational music theory and musicology; Musical features and properties -> musical style and genre",,,,,No,https://drive.google.com/file/d/13eZzr4F6FtWq7Kb7YCHicXXkl4N3zA8R/view?usp=share_link,https://drive.google.com/file/d/1-7SRb1F67xRtNMhbnUuc06tTkUX2YJ8N/view?usp=share_link,https://drive.google.com/file/d/1O2570jxaug06VoO0xsDhykKHpqJiMlV4/view?usp=share_link,https://drive.google.com/file/d/1qualw556L5tVvL-2lA3CeS-tWGvHDswT/view?usp=share_link,https://drive.google.com/file/d/182IJrfhDQeOjnudgqPFEV672n0sYgkEh/view?usp=share_link,https://ismir2024.slack.com/archives/C07VCQY1D96,p1-04-harmonic-and-transposition
89,2,3,17,San Francisco,FALSE,End-to-end automatic singing skill evaluation using cross-attention and data augmentation for solo singing and singing with accompaniment,"Automatic singing skill evaluation (ASSE) systems are predominantly designed for solo singing, and the scenario of singing with accompaniment is largely unaddressed. In this paper, we propose an end-to-end ASSE system that effectively processes both solo singing and singing with accompaniment using data augmentation, where a comparative study is conducted on four different data augmentation approaches. Additionally, we incorporate bi-directional cross-attention (BiCA) for feature fusion which, compared to simple concatenation, can better exploit the inter-relationships between different features. Results on the 10KSinging dataset show that data augmentation and BiCA boost performance individually. When combined, they contribute to further significant improvements, with a Pearson correlation coefficient of 0.769 for solo singing and 0.709 for singing with accompaniment. This represents relative improvements of 36.8% and 26.2% compared to the baseline model score of 0.562, respectively.",Yaolong Ju,Yaolong Ju (Huawei)*; Chun Yat Wu (Huawei); Betty Cortiñas Lorenzo  (Huawei); Jing Yang (Huawei 2012 Labs); Jiajun Deng (Huawei); Fan Fan (Huawei); Simon Lui (Huawei),"Ju, Yaolong*; Wu, Chun Yat; Lorenzo , Betty Cortinas; Yang, Jing; Deng, Jiajun; FAN, FAN; Lui, Simon","Musical features and properties -> timbre, instrumentation, and singing voice","Applications -> music composition, performance, and production; Knowledge-driven approaches to MIR -> machine learning/artificial intelligence for music; MIR fundamentals and methodology -> music signal processing; Musical features and properties -> expression and performative aspects of music",,,,,No,https://drive.google.com/file/d/1iTqz4z5OY5AaRH_0QhYaPILXT5iSZNle/view?usp=share_link,,,,,https://ismir2024.slack.com/archives/C07U9F05UDD,p3-17-end-to-end
90,2,4,19,San Francisco,FALSE,MelodyT5: A Unified Score-to-Score Transformer for Symbolic Music Processing,"In the domain of symbolic music research, the progress of developing scalable systems has been notably hindered by the scarcity of available training data and the demand for models tailored to specific tasks. To address these issues, we propose MelodyT5, a novel unified framework that leverages an encoder-decoder architecture tailored for symbolic music processing in ABC notation. This framework challenges the conventional task-specific approach, considering various symbolic music tasks as score-to-score transformations. Consequently, it integrates seven melody-centric tasks, from generation to harmonization and segmentation, within a single model. Pre-trained on MelodyHub, a newly curated collection featuring over 261K unique melodies encoded in ABC notation and encompassing more than one million task instances, MelodyT5 demonstrates superior performance in symbolic music processing via multi-task transfer learning. Our findings highlight the efficacy of multi-task transfer learning in symbolic music processing, particularly for data-scarce tasks, challenging the prevailing task-specific paradigms and offering a comprehensive dataset and framework for future explorations in this domain.",Maosong Sun,Shangda Wu (Central Conservatory of Music); Yashan Wang (Central Conservatory of Music); Xiaobing Li (Central Conservatory of Music); Feng Yu (Central Conservatory of Music); Maosong Sun (Tsinghua University)*,"Wu, Shangda; Wang, Yashan; Li, Xiaobing; Yu, Feng; Sun, Maosong*",MIR fundamentals and methodology -> symbolic music processing,"Evaluation, datasets, and reproducibility -> novel datasets and use cases; MIR tasks -> music generation; Musical features and properties -> harmony, chords and tonality; Musical features and properties -> melody and motives; Musical features and properties -> structure, segmentation, and form",,,,,No,https://drive.google.com/file/d/1I72iajjKOPsQMmee8CDFiNCSIkQdArvP/view?usp=share_link,https://drive.google.com/file/d/1GaJwHFJhCRNmFLeZGYLMhi9EKvnr7JV6/view?usp=share_link,https://drive.google.com/file/d/1jZrxMhcXPZU7iMAQID3nf_BI246t2GNs/view?usp=share_link,https://drive.google.com/file/d/1KZHABImBHV5T-_TK4OEVb1glgv-Xpbs5/view?usp=share_link,https://drive.google.com/file/d/1aksTuwefarTg6uroZCse-gSPK7_vHCu1/view?usp=share_link,https://ismir2024.slack.com/archives/C07UM5U0SCV,p4-19-melodyt5-a-unified
91,1,2,14,San Francisco,FALSE,MusiConGen: Rhythm and Chord Control for Transformer-Based Text-to-Music Generation,"Existing text-to-music models can produce high-quality audio with great diversity. However, textual prompts alone cannot precisely control temporal musical features such as chords and rhythm of the generated music. To address this challenge, we introduce MusiConGen, a temporally-conditioned Transformer-based text-to-music  model that builds upon the pretrained MusicGen framework. Our innovation lies in an efficient finetuning mechanism, tailored for consumer-grade GPUs, that integrates automatically-extracted chords and rhythm features as the control signal. During inference, the control can either be musical features extracted from a reference audio signal, or be user-defined symbolic chord sequence, BPM, and textual prompts. Our performance evaluation on two datasets---one derived from extracted features and the other from user-created inputs---demonstrates that MusiConGen can generate realistic music that aligns well with the specified temporal control. Sound examples can be found at the supplementary material and the anonymous demo page, \url{https://musicongen.github.io/musicongen_demo/}.",Yun-Han Lan,Yun-Han Lan (Taiwan AI Labs)*; Wen-Yi Hsiao (Taiwan AI Labs); Hao-Chung Cheng (National Taiwan University); Yi-Hsuan Yang (National Taiwan University),"Lan, Yun-Han*; Hsiao, Wen-Yi; Cheng, Hao-Chung; Yang, Yi-Hsuan",MIR tasks -> music generation,"Generative Tasks; MIR fundamentals and methodology -> music signal processing; Musical features and properties -> harmony, chords and tonality; Musical features and properties -> rhythm, beat, tempo",,,,,No,https://drive.google.com/file/d/11kDKpVYCpSs9YI2UGG9QecHPLjwvv2pv/view?usp=share_link,https://drive.google.com/file/d/1vXa5hVkLjiP-AsDcsQmkokGJekFP-6gd/view?usp=share_link,https://drive.google.com/file/d/1uZgfvu9DHuCKXcIOYjnMWWVEwHWVV4Rb/view?usp=share_link,https://drive.google.com/file/d/1RzIDsBLRZwLAWZo6aQsL_5mEw6IdL-B2/view?usp=share_link,https://drive.google.com/file/d/14V0q_J8JYseA8DoNRtNGkekBEWzWMIot/view?usp=share_link,https://ismir2024.slack.com/archives/C07UM5U2FGV,p2-14-musicongen-rhythm-and
96,2,3,7,San Francisco,FALSE,SpecMaskGIT: Masked Generative Modelling of Audio Spectrogram for Efficient Audio Synthesis and Beyond,"Recent advances in generative models that iteratively synthesize audio clips sparked great success in text-to-audio synthesis (TTA), but at the cost of slow synthesis speed and heavy computation. Although there have been attempts to accelerate the iterative procedure, high-quality TTA systems remain inefficient due to the hundreds of iterations required in the inference phase and large amount of model parameters. To address these challenges, we propose SpecMaskGIT, a light-weight, efficient yet effective TTA model based on the masked generative modeling of spectrograms. First, SpecMaskGIT synthesizes a realistic 10 s audio clip in less than 16 iterations, an order of magnitude less than previous iterative TTA methods. As a discrete model, SpecMaskGIT outperforms larger VQ-Diffusion and auto-regressive models in a TTA benchmark, while being real-time with only 4 CPU cores or even 30× faster with a GPU. Next, built upon a latent space of Mel-spectrograms, SpecMaskGIT has a wider range of applications (e.g., zero-shot bandwidth extension) than similar methods built on latent wave domains. Moreover, we interpret SpecMaskGIT as a generative extension to previous discriminative audio masked Transformers, and shed light on its audio representation learning potential. We hope that our work will inspire the exploration of masked audio modeling toward further diverse scenarios.",Zhi Zhong,Marco Comunità (Queen Mary University of London); Zhi Zhong (Sony Group Corporation)*; Akira Takahashi (Sony Group Corporation); Shiqi Yang (Sony); Mengjie Zhao (Sony Group Corporation); Koichi Saito (Sony Gruop Corporation); Yukara Ikemiya (Sony Research); Takashi Shibuya (Sony AI); Shusuke Takahashi (Sony Group Corporation); Yuki Mitsufuji (Sony AI),"Comunita, Marco; Zhong, Zhi*; Takahashi, Akira; Yang, Shiqi; Zhao, Mengjie; Saito, Koichi; Ikemiya, Yukara; Shibuya, Takashi; Takahashi, Shusuke; Mitsufuji, Yuki",Generative Tasks -> music and audio synthesis,Generative Tasks -> interactions; Generative Tasks -> real-time considerations; Generative Tasks -> transformations; MIR tasks -> automatic classification; Musical features and properties -> representations of music,,,,,No,https://drive.google.com/file/d/1Vinmy5AVoQSPJOvA-qYFu32kPhx8_r8x/view?usp=sharing,https://drive.google.com/file/d/1GvfnJaoT73dkCHy0CsV5WcrTSjfomUFe/view?usp=sharing,https://drive.google.com/file/d/1YZkyRX_07zw72sOvTA9eoaEjcDtPfVIm/view?usp=sharing,https://drive.google.com/file/d/1h34o3dFNby363faQnn4IYC8mFwPWu4fc/view?usp=sharing,https://docs.google.com/presentation/d/1gS6pbZypIAgkwD1-Je0v0T4Ecr3eSHGl/edit?usp=share_link&ouid=110993997319166704578&rtpof=true&sd=true,https://ismir2024.slack.com/archives/C07U9F0AJ6T,p3-07-specmaskgit-masked-generative
101,2,3,14,San Francisco,FALSE,MMT-BERT: Chord-aware Symbolic Music Generation Based on Multitrack Music Transformer and MusicBERT,"We propose a novel symbolic music representation and Generative Adversarial Network (GAN) framework specially designed for symbolic multitrack music generation. The main theme of symbolic music generation primarily encompasses the preprocessing of raw audio data and the implementation of a deep learning framework. Current techniques dedicated to symbolic music generation generally encounter two significant challenges: training data's lack of information about chords and scales and the requirement of specially designed model architecture adapted to the unique format of symbolic music representation. In this paper, we solve the above problems by introducing new symbolic music representation with MusicLang chord analysis model. We propose our MMT-BERT architecture adapting to the representation. To build a robust multitrack music generator, we fine-tune a pre-trained MusicBERT model to serve as the discriminator, and incorporate relativistic standard loss. This approach, supported by the in-depth understanding of symbolic music encoded within MusicBERT, fortifies the consonance and humanity of music generated by our method. Experimental results demonstrate the effectiveness of our approach which strictly follows the state-of-the-art methods.",Jinlong ZHU,Jinlong ZHU (Hokkaido University)*; Keigo Sakurai (Hokkaido University); Ren Togo (Hokkaido University); Takahiro Ogawa (Hokkaido University); Miki Haseyama (Hokkaido University),"ZHU, Jinlong*; Sakurai, Keigo; Togo, Ren; Ogawa, Takahiro; Haseyama, Miki",MIR tasks -> music generation,"MIR fundamentals and methodology -> symbolic music processing; Musical features and properties -> harmony, chords and tonality; Musical features and properties -> representations of music",,,,,No,https://drive.google.com/file/d/1h2RYen_J2xlE_zcIMKar6f6grNUAsP2C/view?usp=sharing,https://drive.google.com/file/d/1ShFl4bLk6UHjMko6B562YsCrbwWrtQKF/view?usp=sharing,https://drive.google.com/file/d/1V-r2tzbzCUOKtJWrLyoxeOmBnNSKeAB-/view?usp=sharing,https://drive.google.com/file/d/13TVApqN6sCQay-u3RZCWiJK6LzyXrfBW/view?usp=sharing,https://drive.google.com/file/d/1MUXmyFSFeDJFdQPBWVdcJt_1vVGJPY8F/view?usp=share_link,https://ismir2024.slack.com/archives/C07U9F0C4RM,p3-14-mmt-bert-chord
103,2,4,14,San Francisco,FALSE,TheGlueNote: Learned Representations for Robust and Flexible Note Alignment,"Note alignment refers to the task of matching individual notes of two versions of the same symbolically encoded piece. Methods addressing this task commonly rely on sequence alignment algorithms such as Hidden Markov Models or Dynamic Time Warping (DTW) applied directly to note or onset sequences. While successful in many cases, such methods struggle with large mismatches between the versions. In this work, we learn note-wise representations from data augmented with various complex mismatch cases, e.g. repeats, skips, block insertions, and long trills. At the heart of our approach lies a transformer encoder network --- TheGlueNote --- which predicts pairwise note similarities for two 512 note subsequences. We postprocess the predicted similarities using flavors of weightedDTW and pitch-separated onsetDTW to retrieve note matches for two sequences of arbitrary length. Our approach performs on par with the state of the art in terms of note alignment accuracy, is considerably more robust to version mismatches, and works directly on any pair of MIDI files.",Silvan Peter,Silvan David Peter (JKU)*; Gerhard Widmer (Johannes Kepler University),"Peter, Silvan*; Widmer, Gerhard","MIR tasks -> alignment, synchronization, and score following",MIR fundamentals and methodology -> symbolic music processing,,,,,No,https://drive.google.com/file/d/1GHRxv4pvcpny1pO3Lgx1W1u7kbGoUXnn/view?usp=sharing,https://drive.google.com/file/d/12FVcGsJpZaS3qKKGy82vNAFXsaaoTm_9/view?usp=sharing,https://drive.google.com/file/d/1PfmicdgUqlBQIlc7QFRllz3Km0qc3w_D/view?usp=sharing,https://drive.google.com/file/d/1CcnPsI0Fq-S-7zkqwYY6WIRd5K3wrNAn/view?usp=share_link,https://drive.google.com/file/d/1aAlxzvZpTkBq7dEnpPFDXIyUMlq-LFNm/view?usp=share_link,https://ismir2024.slack.com/archives/C07UPU92QGK,p4-14-thegluenote-learned-representations
104,1,2,2,San Francisco,FALSE,Lessons learned from a project to encode Mensural music on a large scale with Optical Music Recognition,"This paper discusses the transcription of a collection of musical works using Optical Music Recognition (OMR) technologies during the implementation of the Spanish PolifonIA project. The project employs a research-oriented OMR application that leverages modern Artificial Intelligence (AI) technology to encode musical works from images into structured formats. The paper outlines the transcription workflow in several phases: selection, preparation, action, and resolution, emphasizing the efficiency of using AI to reduce manual transcription efforts. The tool facilitated various tasks such as document analysis, management of parts, and automatic content recognition, although manual corrections were still indispensable for ensuring accuracy, especially for complex musical notations and layouts. Our study also highlights the iterative process of model training and corrections that gradually improved transcription speed and accuracy. Furthermore, the paper delves into challenges like managing non-musical elements and the limitations of current OMR technologies with early musical notations. Our findings suggest that while automated tools significantly accelerate the transcription process, they require continuous refinement and human oversight to handle diverse and complex musical documents effectively.",David Rizo,David Rizo (University of Alicante. Instituto Superior de Enseñanzas Artísrticas de la Comunidad Valenciana)*; Jorge Calvo-Zaragoza (University of Alicante); Patricia García-Iasci (University of Alicante); Teresa Delgado-Sánchez (Biblioteca Nacional de España),"Rizo, David*; Calvo-Zaragoza, Jorge; Delgado-Sánchez, Teresa; García-Iasci, Patricia",Applications -> digital libraries and archives,MIR tasks -> optical music recognition,,,,,No,https://drive.google.com/file/d/1NLEOmBHoUA5CLQvB9Bzolv9PWAIPySnl/view?usp=share_link,,,,,https://ismir2024.slack.com/archives/C07VCQYBRG8,p2-02-lessons-learned-from
113,2,3,1,Remote,TRUE,Green MIR? Investigating computational cost of recent music-Ai research in ISMIR,"The environmental footprint of Generative AI and other Deep Learning (DL) technologies is increasing. To understand the scale of the problem and to identify solutions for avoiding excessive energy use in DL research at communities such as ISMIR, more knowledge is needed of the current energy cost of the undertaken research. In this paper, we provide a scoping inquiry of how the ISMIR research concerning automatic music generation (AMG) and computing-heavy music analysis currently discloses information related to environmental impact. We present a study based on two corpora that document 1) ISMIR papers published in the years 2017–2023 that introduce an AMG model, and 2) ISMIR papers from the years 2022–2023 that propose music analysis models and include heavy computations with GPUs. Our study demonstrates a lack of transparency in model training documentation. It provides the first estimates of energy consumption related to model training at ISMIR, as a baseline for making more systematic estimates about the energy footprint of the ISMIR conference in relation to other machine learning events. Furthermore, we map the geographical distribution of generative model contributions and discuss the corporate role in the funding and model choices in this body of work.",Andre Holzapfel,"Andre Holzapfel (KTH Royal Institute of Technology in Stockholm)*; Anna-Kaisa Kaila (KTH Royal Institute of Technology, Stockholm); Petra Jääskeläinen (KTH)","Holzapfel, Andre*; Kaila, Anna-Kaisa; Jääskeläinen, Petra",Philosophical and ethical discussions -> ethical issues related to designing and implementing MIR tools and technologies,"Evaluation, datasets, and reproducibility -> reproducibility; Knowledge-driven approaches to MIR -> machine learning/artificial intelligence for music; Philosophical and ethical discussions -> legal and societal aspects of MIR",,,,,Yes,https://drive.google.com/file/d/1rAepoJk1U2R4g3S_AcxdqWDGzRGd7xPg/view?usp=sharing,https://drive.google.com/file/d/1FIrhz2X1ejLKxNdDNhi3msM28OhC1MA3/view?usp=share_link,https://drive.google.com/file/d/1cYKFcKBYn5ndyPg95kzhNTzvaUouhemE/view?usp=share_link,https://drive.google.com/file/d/1tPtxxZyBA0nvUGkMXkTlkGIyxkIwzxft/view?usp=share_link,https://drive.google.com/file/d/1O0QwwL0Wl4M2Qq_7MqW3DtwODgviHBsh/view?usp=share_link,https://ismir2024.slack.com/archives/C07UPU957MZ,p3-01-green-mir-investigating
114,2,4,7,San Francisco,FALSE,PiCoGen2: Piano cover generation with transfer learning approach and weakly aligned data,"Piano cover generation aims to create a piano cover from a pop song. Existing approaches mainly employ supervised learning and the training demands strongly-aligned and paired song-to-piano data, which is built by remapping piano notes to song audio. This would, however, result in the loss of piano information and accordingly cause inconsistencies between the original and remapped piano versions. To overcome this limitation, we propose a transfer learning approach that pre-trains our model on piano-only data and fine-tunes it on weakly-aligned paired data constructed without note remapping. During pre-training, to guide the model to learn piano composition concepts instead of merely transcribing audio, we use an existing lead sheet transcription model as the encoder to extract high-level features from the piano recordings. The pre-trained model is then fine-tuned on the paired song-piano data to transfer the learned composition knowledge to the pop song domain. Our evaluation shows that this training strategy enables our model, named PiCoGen2, to attain high-quality results, outperforming baselines on both objective and subjective metrics across five pop genres.",Chih-Pin Tan,Chih-Pin Tan (National Taiwan University)*; Hsin Ai (National Taiwan University); Yi-Hsin Chang (National Taiwan University); Shuen-Huei Guan (KKCompany Techonologies); Yi-Hsuan Yang (National Taiwan University),"Tan, Chih-Pin*; Ai, Hsin; Chang, Yi-Hsin; Guan, Shuen-Huei; Yang, Yi-Hsuan",Generative Tasks,"Applications -> music composition, performance, and production; Generative Tasks -> transformations; Knowledge-driven approaches to MIR -> machine learning/artificial intelligence for music; MIR tasks -> music generation; Musical features and properties -> musical style and genre",,,,,No,https://drive.google.com/file/d/1ZtVeAwZ4H40Ed2JSPt2uKGBJNjhMvXcP/view?usp=drive_link,https://drive.google.com/file/d/1GN7GywKGpF4j-DxhbAJey0_uLccSOJre/view?usp=drive_link,https://drive.google.com/file/d/1YM75UhJ5geuLqXYH111Zk8vm9diDLPtd/view?usp=drive_link,https://drive.google.com/file/d/1c8Y5WtQiVYHB4GSufL3261GJ2Y00-rWZ/view?usp=drive_link,https://drive.google.com/file/d/1h-Nky-9BXM0U2jBzVyvuYQClaoQ_QGgS/view?usp=drive_link,https://ismir2024.slack.com/archives/C07V2MNBZT3,p4-07-picogen2-piano-cover
